
:DEBxapGFgWqtg4J;Geld verdienen mit Online-Umfragen? Geht das wirklich? ğŸ˜±JDie AllestesterJ22J2017-11-13T01:49:24.000ZJ32709J3093J296
v:DEB2kyS6SvSYSEJ"WE WANT TO TALK ABOUT OUR MARRIAGEJCaseyNeistatJ22J2017-11-13T17:13:01.000ZJ748374J57532J2966
:DEBk_IrAnVSjYEJ0GrÃ¼ner Kaffee zum Abnehmen, hilft das wirklich?JTanja BremerJ22J2017-11-13T01:27:05.000ZJ9413J1522J39
…:DEBcJx5blgWjDwJ8HÃ¶re NICHT diese Sprachnachricht an.. (WIRKLICH NICHT!)JJarowJ24J2017-11-11T20:55:29.000ZJ373833J21320J2901
j:DEBQtR5SwcDSOkJJohn Oliver - Season 4 FinaleJconsumerJ23J2017-11-13T08:00:56.000ZJ159192J3701J44
‹:DEB8C-4QBgwUukJ0Folge 2808: Angst vor Beatrice | Sturm der LiebeJSturm der Liebe OfficialJ24J2017-11-13T14:10:02.000ZJ48016J787J26
Ä:DEBj9nCXKlZaSMJvAlena TV -Tesfit Abraha - Dgul Hiyab - Part  4 - (á‹µáŒ‰áˆ áˆ…á‹«á‰¥ áˆ«á‰¥á‹“á‹­ áŠ­á‹áˆ)- New Eritrean Movie 2017JAlena TVJ24J2017-11-12T21:09:54.000ZJ174130J4565J292
Ÿ:DEBKNq8laLAqccJUà¹€à¸˜à¸­à¸„à¸·à¸­à¸à¸£à¸«à¸¡à¸¥à¸´à¸‚à¸´à¸• | EP.13 (2/6)  | 13 à¸.à¸¢. 60 | one31Jone31J24J2017-11-13T14:51:22.000ZJ363046J1375J70
•:DEBj8h7KEGcswkJEEngel 11:11 Portal Orakel fÃ¼r die Woche vom 13. bis 19.November 2017JDasEngelOrakelJ1J2017-11-12T09:33:38.000ZJ13363J336J20
l:DEB1NJ7rLUS1PUJ tagesschau 20:00 Uhr, 12.11.2017J
tagesschauJ25J2017-11-12T19:52:26.000ZJ8596J111J15
€:DEBmpdSLQRKqnsJ0Sturm der Liebe Vorschau fÃ¼r Folge 2809 -  2813Jsturmderliebe99J24J2017-11-12T20:36:13.000ZJ17361J60J5
Œ:DEBZvL6RxxflIoJAÙÙŠØ¯ÙŠÙˆ Ù…Ø³Ø±Ø¨ Ù…Ù† ÙƒÙˆØ§Ù„ÙŠØ³ Ù…Ù‚Ø§Ø¨Ù„Ø© Ø§Ù„Ø­Ø±ÙŠØ±ÙŠJDaily SyriaJ22J2017-11-13T11:23:11.000ZJ25992J1J0
:DEB-1DkGrAyTfUJ>Was braucht man wirklich am Auto damit es fÃ¤hrt? | Dumm TÃ¼chJ
Dumm TÃ¼chJ24J2017-11-11T10:30:00.000ZJ281497J11041J348
q:DEBOA0vhAKUD0gJ'Outlander S03E09 i'm melting with you''J	Ella bellJ1J2017-11-12T22:33:48.000ZJ32941J149J2
:DEB1YhtkrC2t0cJCNew Eritrean film Dama (á‹³áˆ›)  part 13 Shalom Entertainment  2017JShalom EntertainmentJ22J2017-11-11T17:21:54.000ZJ260199J4833J302
~:DEBHWtIkDpoSK8J/DAX Mittagsausblick - Verkaufsdruck bleibt hochJGodmodeTrader.deJ25J2017-11-13T12:31:34.000ZJ1460J1J0
€:DEBEGae9gEo_vUJ,Folge 2544: Als Baby vertauscht | Rote RosenJRote Rosen OfficialJ24J2017-11-13T13:10:02.000ZJ7153J88J10
±:DEBvOtqfhwvY94J^100% Kostenlos Gutschein - Ihr wolltet immer Leben wie ein KÃ¶nig? - Ich zeige euch wie VLOG03JWeWantFreeGamesJ22J2017-11-14T19:50:36.000ZJ22151J810J410
:DEB7LYTBVUMnj8JC3 Ideen zum Geld verdienen inklusive Schritt fÃ¼r Schritt AnleitungJĞ˜Ğ½Ğ½Ğ° Ğ¨Ğ¸Ñ€ÑĞµĞ²Ğ°J22J2017-11-14T08:23:05.000ZJ35820J631J257
:DEBxapGFgWqtg4J;Geld verdienen mit Online-Umfragen? Geht das wirklich? ğŸ˜±JDie AllestesterJ22J2017-11-13T01:49:24.000ZJ58265J3126J439
w:DEB2kyS6SvSYSEJ"WE WANT TO TALK ABOUT OUR MARRIAGEJCaseyNeistatJ22J2017-11-13T17:13:01.000ZJ2188675J88100J7150
™:DEBR2ftFltzomAJBKim wird von Jacky psychisch zerstÃ¶rt! | Berlin Tag & Nacht #1563JBerlinTagUndNachtJ22J2017-11-13T18:36:42.000ZJ264167J2125J363
y:DEBnQ4bhUfoh2wJ/Filiz ve Tarik | NISAN | VERLOBUNG | ENGAGEMENTJFi1izmJ22J2017-11-13T20:17:39.000ZJ43667J953J351
–:DEBdLpjfXhytQQJ;Folge 2809: Die verlorene Liebesbotschaft | Sturm der LiebeJSturm der Liebe OfficialJ24J2017-11-14T14:10:02.000ZJ52318J669J29
f:DEBDaQ-rJgeQTwJMSnippets 13.11.2017JMythen MetzgerJ24J2017-11-13T18:58:42.000ZJ18549J1584J22
£:DEB5eFVNA4aUFcJSHimmelstÃ¼rmer-SÃ¤ngerin Franziska tot: So rÃ¼hrend verabschiedet sich ihre FamilieJã€Œ GorillazZ ã€J22J2017-11-14T15:33:55.000ZJ4486J8J2
‰:DEBmZqKoN0F5XAJ6Folge 2545: Ãœberraschende Entschuldigung | Rote RosenJRote Rosen OfficialJ24J2017-11-14T13:10:02.000ZJ7932J93J5
~:DEBP53ocP6cLZ4J,Familie Dr Kleist Folge 83 Freunde oder mehrJFamilie Dr KleistJ1J2017-11-14T18:58:41.000ZJ23227J994J6
Œ:DEBVOodfaZJMTIJ2Joe & David in der FalleğŸ˜® |Berlin Tag und NachtJKÃ¶ln 50667 BTN Exklusiv!J22J2017-11-14T19:07:44.000ZJ15197J75J6
¨:DEBMcE4kVmDrKoJ_Verbringe viel Zeit mit lieben MenschenğŸ’–Zeige es ihnen, dass sie dir am Herzen ğŸ’–liegenâ˜˜J
Nate ZoobeJ1J2017-11-14T06:33:03.000ZJ16158J0J0
k:DEBei1LpoBumeQJKing of Queens Mut zur DummheitJAdem KorkmazJ22J2017-11-14T09:34:31.000ZJ4895J20J1
¬:DEBC7o9lcfj-twJ\Italien VS Schweden 0-0 (Alle Highlights) Italien scheitert in WM Qualifikation Playoff 2017JTIME 4 SPORTJ22J2017-11-13T22:08:29.000ZJ102715J388J52
m:DEBQq_SlZu9VvMJ#Buy & Hold - Funktioniert das noch?J	Jens RabeJ27J2017-11-14T15:00:01.000ZJ4527J231J4
„:DEBZQRhUQm9TPQJ0Åok iddia! Yeliz YeÅŸilmen'i eÅŸi aldattÄ± mÄ±?JSÃ¶ylemezsem OlmazJ22J2017-11-14T09:36:37.000ZJ34081J65J29
›:DEBwYce-AjWQcsJFBasti ist auf 180 und geht Jacky an..  Berlin Tag & Nacht (Folge 1563)JBerlin Tag & NachtJ22J2017-11-13T18:18:04.000ZJ97135J674J22
‘:DEBm6uDHpfMduIJ9SÃ¶z 21 BÃ¶lÃ¼m - NazlÄ± AteÅŸ'in VurulduÄŸunu Ã–ÄŸrenir!JHÄ°DO-Hidayet Ã–zkanJ22J2017-11-13T19:14:58.000ZJ143548J531J30
Ğ:DEBi-9MxEi5oWgJ|Ù…Ø§Ø°Ø§ Ù‚Ø§Ù„Øª Ø§Ù„Ø¥Ø¹Ù„Ø§Ù…ÙŠØ© Ø¨ÙˆÙ„Ø§ ÙŠØ¹Ù‚ÙˆØ¨ÙŠØ§Ù† Ù„Ø¯Ù‰ ÙˆØµÙˆÙ„Ù‡Ø§ Ø¥Ù„Ù‰ Ø¨ÙŠØ±ÙˆØª Ù…Ù† Ø§Ù„Ø³Ø¹ÙˆØ¯ÙŠØ©ØŸJaljadeedonlineJ25J2017-11-13T17:48:20.000ZJ286273J1264J335
o:DEB1tKaA1TW02IJ(Der Neue Firefox ist da: Firefox QuantumJFirefoxJ28J2017-11-14T14:20:28.000ZJ3503J35J7
n:DEB3qtTdwIp89oJ AdÄ±nÄ± Sen Koy Fragman ğŸ˜»ğŸ˜»JGaye TurgutJ22J2017-11-14T16:28:55.000ZJ80649J822J11
Š:DEBDupviAaffdkJ5Stephen Colbert monologue 11/13/17 : Too Much Moore !JFederica BalsamoJ17J2017-11-14T05:22:11.000ZJ187026J786J121
Œ:DEBdcd9a3CAumkJ3The Saintcoms: Die Abrahams | Gute Arbeit OriginalsJGute Arbeit OriginalsJ24J2017-11-13T07:00:01.000ZJ31013J3587J45
:DEBwZRqe9wQCVkJ(Momente der Woche vom 14.11 - 22.11.2017JLuna Maries SeelenblickJ22J2017-11-14T11:12:19.000ZJ3467J96J5
ˆ:DEBtYT-JVCsCFwJ?Soy Luna 2 - Luna will das Matteo sie in Ruhe lÃ¤sst (Folge 57)J
Soy LunitaJ1J2017-11-14T19:22:11.000ZJ2164J79J0
ƒ:DEBqTKa9XZUoGIJ0Siyah Beyaz AÅŸk 5. BÃ¶lÃ¼m - Al TatlÄ± SeversinJDizi ve Filmler 2J10J2017-11-14T08:38:28.000ZJ65933J376J9
j:DEBmnXnLeo54FAJBVG â€“ Ohne UnsJWeil wir dich liebenJ24J2017-11-15T09:00:19.000ZJ684104J4014J183
z:DEBJuoPln48C7oJ$Grundeinkommens-Verlosung 15.11.2017JMein GrundeinkommenJ25J2017-11-15T18:39:45.000ZJ13309J217J33
{:DEBTvUI233eaSgJ(Das Leben als YouTuber (Positiv&Negativ)JMontanaBlackJ22J2017-11-15T17:01:20.000ZJ159360J16978J474
‡:DEB5EdrxW8znNoJ2Berlin Tag & Nacht Highlights vom 15.11.2017 #1566JBerlin Tag & NachtJ22J2017-11-15T19:33:55.000ZJ68166J471J27
~:DEBuPJl261HzXIJ'DiriliÅŸ ErtuÄŸrul 96.BÃ¶lÃ¼m FragmanÄ±JDiriliÅŸ TelevizyonJ1J2017-11-15T20:38:12.000ZJ110566J1179J30
{:DEBPCqg5O1wosgJ(Folge 2546: Hass auf Gunter | Rote RosenJRote Rosen OfficialJ24J2017-11-15T13:10:02.000ZJ7310J95J5
¬:DEBKPV4Pac3muAJPWWE Smackdown 14 November Highlights HD - WWE Smackdown 14/11/2017 Highlights HDJWrestling Reality IIJ17J2017-11-15T03:31:47.000ZJ1502902J11298J920
:DEBgx-u6oHEImAJ3BÄƒieÈ›i de oraÅŸ SEZONUL 2 EPISODUL 10 PARTEA 2 HDJ
Razvan RazJ22J2017-11-15T19:47:26.000ZJ111618J895J52
]:DEB4bFe8EqrjioJIMSR Fly-ByJTerrestrial EnergyJ28J2016-06-06T16:18:28.000ZJ7145J15J1
¥:DEBovZ-X6eHdXIJPSiyah Beyaz AÅŸk 5. BÃ¶lÃ¼m - Komik Sahne - Bir Bebekte Ferhat`lardan BekliyorumJDizi ve Filmler 2J10J2017-11-15T08:44:33.000ZJ119289J512J16
‚:DEBzNKH2cIrutkJ4Engel Orakel der Liebe vom 15. bis 22. November 2017JDasEngelOrakelJ1J2017-11-15T08:26:57.000ZJ7802J221J5
}:DEB0nuW_0SBHooJ'Meteorit Ã¼ber SÃ¼ddeutschland im VideoJSchwÃ¤bische ZeitungJ25J2017-11-15T09:01:32.000ZJ21645J177J8
:DEBRBY1sQTAOucJ5Folge 2810: Zweifel an der Hochzeit | Sturm der LiebeJSturm der Liebe OfficialJ24J2017-11-15T14:10:02.000ZJ57697J794J44
z:DEBnQ4bhUfoh2wJ/Filiz ve Tarik | NISAN | VERLOBUNG | ENGAGEMENTJFi1izmJ22J2017-11-13T20:17:39.000ZJ47895J1008J355
:DEBVOodfaZJMTIJ2Joe & David in der FalleğŸ˜® |Berlin Tag und NachtJKÃ¶ln 50667 BTN Exklusiv!J22J2017-11-14T19:07:44.000ZJ26943J129J15
d:DEBVz3sDWE_mUIJClash Royale Cheat | 100% freeJGodJ22J2017-11-11T06:22:23.000ZJ81144J7226J8
p:DEB752sMEfttaoJDolunay 20.BÃ¶lÃ¼m 2.FragmanÄ±JÃ–zge GÃ¼rel FanJ22J2017-11-15T16:37:28.000ZJ38367J344J4
Ÿ:DEB7LYTBVUMnj8JC3 Ideen zum Geld verdienen inklusive Schritt fÃ¼r Schritt AnleitungJĞ˜Ğ½Ğ½Ğ° Ğ¨Ğ¸Ñ€ÑĞµĞ²Ğ°J22J2017-11-14T08:23:05.000ZJ62013J1506J447
˜:DEBycrmp8eEAGYJFJimmy Kimmel monologue 11/14/17: Sessions Testimony, Don Jr. WikileaksJFull InterviewJ22J2017-11-15T05:07:03.000ZJ161482J936J97
:DEBxapGFgWqtg4J;Geld verdienen mit Online-Umfragen? Geht das wirklich? ğŸ˜±JDie AllestesterJ22J2017-11-13T01:49:24.000ZJ85447J3131J469
”:DEBx7UHtGZgpWQJKSoy Luna 2 - Die anderen treffen Juliana weinend in der Umkleide (Folge 58)J
Soy LunitaJ1J2017-11-15T19:02:37.000ZJ2773J77J1
`:DEBECfCYqNmylMJGood vybz onlyJCharlotte BlackburnJ22J2017-10-23T19:13:40.000ZJ1176J0J0
™:DEBR2ftFltzomAJBKim wird von Jacky psychisch zerstÃ¶rt! | Berlin Tag & Nacht #1563JBerlinTagUndNachtJ22J2017-11-13T18:36:42.000ZJ275391J2172J372
k:DEBabqute8AylEJ tagesschau 20:00 Uhr, 14.11.2017J
tagesschauJ25J2017-11-14T20:13:12.000ZJ7807J95J10
w:DEB2kyS6SvSYSEJ"WE WANT TO TALK ABOUT OUR MARRIAGEJCaseyNeistatJ22J2017-11-13T17:13:01.000ZJ2325233J91111J7543
‘:DEBZ5mu5s_yDwUJ<Stephen Colbert - Nov 14, 2017  : Sessions In The Hot Seat !JFederica BalsamoJ22J2017-11-15T05:11:55.000ZJ177233J736J120
m:DEBmnXnLeo54FAJBVG â€“ Ohne UnsJWeil wir dich liebenJ24J2017-11-15T09:00:19.000ZJ1587734J11055J1083
y:DEBlTQlbULOrCgJ)A New View - OnePlus 5T Launch Event LiveJOnePlusJ28J2017-11-16T17:46:45.000ZJ1028474J19155J1268
{:DEBTvUI233eaSgJ(Das Leben als YouTuber (Positiv&Negativ)JMontanaBlackJ22J2017-11-15T17:01:20.000ZJ229133J21471J739
~:DEB0nuW_0SBHooJ'Meteorit Ã¼ber SÃ¼ddeutschland im VideoJSchwÃ¤bische ZeitungJ25J2017-11-15T09:01:32.000ZJ59623J787J49
Š:DEBLJoWy7_fpy4J/Folge 2811: Spontane Hochzeit | Sturm der LiebeJSturm der Liebe OfficialJ24J2017-11-16T14:10:01.000ZJ57960J835J56
˜:DEBRX9Osj1jTkMJHDirk MÃ¼ller - Horror! UN verzichtet auf Verbot autonom tÃ¶tender WaffenJCashkurs.comJ25J2017-11-15T13:26:50.000ZJ34653J1226J23
{:DEBJuoPln48C7oJ$Grundeinkommens-Verlosung 15.11.2017JMein GrundeinkommenJ25J2017-11-15T18:39:45.000ZJ23628J286J218
h:DEBD6tsYyOMALgJNimo - ZOEY (Handypreview)J	385idÃ©alJ10J2017-11-16T21:26:22.000ZJ36381J4522J125
ƒ:DEBgx-u6oHEImAJ3BÄƒieÈ›i de oraÅŸ SEZONUL 2 EPISODUL 10 PARTEA 2 HDJ
Razvan RazJ22J2017-11-15T19:47:26.000ZJ287756J1869J143
­:DEBKPV4Pac3muAJPWWE Smackdown 14 November Highlights HD - WWE Smackdown 14/11/2017 Highlights HDJWrestling Reality IIJ17J2017-11-15T03:31:47.000ZJ1762418J12532J1087
‡:DEB5EdrxW8znNoJ2Berlin Tag & Nacht Highlights vom 15.11.2017 #1566JBerlin Tag & NachtJ22J2017-11-15T19:33:55.000ZJ74440J513J50
Y:DEBZKwvluTGDaIJWindow DressingJ	Jens RabeJ27J2017-11-16T15:00:03.000ZJ3114J136J6
h:DEBdwUWvzQF_swJNovember 16, 2017JMe Swathi NaiduJ22J2017-11-15T19:55:19.000ZJ1977868J3473J1591
n:DEB39mivDbyWe8JGlÃ¼cklich verheiratet - 92/17JWitz vom OlliJ24J2017-11-16T06:51:42.000ZJ29072J565J35
·:DEBGNCDYzP-OdYJhğŸ†• Ryszard Legutko merytorycznie MIAÅ»DÅ»Y antyPOLSKÄ„ ORG*Ä˜ w PE - MEGA OSTROğŸ”¥ğŸ”¥ğŸ”¥[CAÅOÅšÄ†]J
MASAKRACJAJ25J2017-11-15T10:18:57.000ZJ89700J1635J180
s:DEBVhqmuM28Tk4JRita Ora @ The Voice of GermanyJ4naloCannibaloJ24J2017-11-17T10:45:51.000ZJ211721J2726J180
m:DEBmnXnLeo54FAJBVG â€“ Ohne UnsJWeil wir dich liebenJ24J2017-11-15T09:00:19.000ZJ2146772J14456J1569
»:DEBnz45DMMcjPsJdAndre bekommt eine gebl*sen??? Kim wird doch weiter gemobbt? Vorschau Berlin Tag & Nacht 20.11-24.11JBerlin Tag & NachtJ22J2017-11-17T19:04:10.000ZJ163148J1222J73
:DEB0nuW_0SBHooJ'Meteorit Ã¼ber SÃ¼ddeutschland im VideoJSchwÃ¤bische ZeitungJ25J2017-11-15T09:01:32.000ZJ81538J1143J78
:DEBqHpg70B5I1oJDNew  Eritrean film Dama (á‹³áˆ› ) part  14 Shalom Entertainment 2017JShalom EntertainmentJ22J2017-11-17T13:53:33.000ZJ167696J3569J153
 :DEBIEc_kJlrh7kJLJimmy Kimmel Monologue 11/16/17 Kimmel Tackles Al Franken, Updates Roy MooreJFull InterviewJ22J2017-11-17T05:16:28.000ZJ287346J1178J191
­:DEBx6SioXmI8doJFFantastic Beasts: The Crimes of Grindelwald International - First LookJ#Warner Bros. Pictures InternationalJ1J2017-11-16T13:54:08.000ZJ294430J1531J33
„:DEBoSaA3o62eZoJ5Sheldon parents taking Sheldon to family PsychiatristJSheikh MusaJ22J2017-11-17T04:49:27.000ZJ173225J807J31
f:DEBKCkGeinf3-AJEdle AdventskraÌˆnzeJImke RiedebuschJ26J2017-11-17T14:20:27.000ZJ13649J428J20
n:DEB39mivDbyWe8JGlÃ¼cklich verheiratet - 92/17JWitz vom OlliJ24J2017-11-16T06:51:42.000ZJ40974J651J55
k:DEBXlCHEONTqncJWE ARE ALL GOING TO D1E.J	PewDiePieJ15J2017-11-16T17:53:31.000ZJ2244679J174921J3035
y:DEBlTQlbULOrCgJ)A New View - OnePlus 5T Launch Event LiveJOnePlusJ28J2017-11-16T17:46:45.000ZJ1069416J19475J1303
‡:DEB2p2yFIBv5L8J3Folge 2548: Mutter und Tochter vereint | Rote RosenJRote Rosen OfficialJ24J2017-11-17T13:10:02.000ZJ9147J126J8
‘:DEBZZU6MK8rdpIJ6Folge 2812: Abschied vom FÃ¼rstenhof | Sturm der LiebeJSturm der Liebe OfficialJ24J2017-11-17T14:10:02.000ZJ52803J757J29
{:DEBTvUI233eaSgJ(Das Leben als YouTuber (Positiv&Negativ)JMontanaBlackJ22J2017-11-15T17:01:20.000ZJ248072J22473J814
‹:DEBoHQRoZA3SXcJ4Star Wars The Clone Wars Die - Verschwundenen Teil 2JStar Wars Clips DeutschJ22J2017-11-17T17:35:56.000ZJ4112J49J2
€:DEBJPvuU7Evg5cJ6Soy Luna 2 - Ambar meint sie sei Sol Benson (Folge 60)J
Soy LunitaJ1J2017-11-17T19:02:06.000ZJ3719J137J0
h:DEBD6tsYyOMALgJNimo - ZOEY (Handypreview)J	385idÃ©alJ10J2017-11-16T21:26:22.000ZJ86339J6657J214
—:DEB4L3taD4TgO0J5Alex ist geschockt das Ben so eine teuere Wohnung hatJ Btn und KÃ¶ln Videos Alte FolgenJ22J2017-11-16T17:34:50.000ZJ41731J301J9
›:DEB580KzmOvQdYJCBerlin - Tag & Nacht   | Der Krieg zwischen Paula und Mandy 1566 #1JBerlin â€“ Tag & NachtJ22J2017-11-16T18:31:25.000ZJ30713J165J8
’:DEBUzL31U-O_SIJ@KuÌˆhlschrank Challenge | Erdnussbutter Lasagne | Florian MennenJFlorian MennenJ26J2017-11-17T17:00:17.000ZJ15619J1398J23
x:DEBSlz9KZWkPLUJ*The big bang theory S11 E08: Cherry on topJDanish KhanJ24J2017-11-17T08:29:52.000ZJ58678J213J11
q:DEBfb136NQUoYAJ&Michael Schumacher: Herber RÃ¼ckschlagJTop NewsJ25J2017-11-16T16:44:15.000ZJ21886J20J121
”:DEBH-ax7k8_8n8JHLisa & Lena - Laudatio bei der Bambi Verleihung in Berlin vom 16.11.2017J	leliworldJ22J2017-11-16T23:41:48.000ZJ27697J752J33
s:DEB0Fe34--GeRwJ#Schluss mit dem Theater - BTN #1566JB&K HighlightJ24J2017-11-16T18:38:03.000ZJ52892J356J15
‹:DEBQzSFwci20_8J/Alessia fÃ¼hlt sich unwohlğŸ™„ğŸ˜¶ |KÃ¶ln 50667JKÃ¶ln 50667 BTN Exklusiv!J22J2017-11-16T18:17:50.000ZJ53179J330J19
s:DEBVhqmuM28Tk4JRita Ora @ The Voice of GermanyJ4naloCannibaloJ24J2017-11-17T10:45:51.000ZJ448671J5991J604
¼:DEBnz45DMMcjPsJdAndre bekommt einen gebl*sen?? Kim wird doch weiter gemobbt? Vorschau Berlin Tag & Nacht 20.11-24.11JBerlin Tag & NachtJ22J2017-11-17T19:04:10.000ZJ285956J1704J521
m:DEBmnXnLeo54FAJBVG â€“ Ohne UnsJWeil wir dich liebenJ24J2017-11-15T09:00:19.000ZJ2382975J15917J1708
“:DEBDY7vA_OuF2oJ?Huge pile up - Crash - 2017 Macau Grand Prix - FIA GT World CupJWeber NiraschtoeJ17J2017-11-18T05:19:37.000ZJ294686J558J15
•:DEB4HZZtJ06ZqoJGDaniel Hegerty Fatal Motorcycle crash At Macau 2017 Macau Motorcycle GPJswarmrunnerJ22J2017-11-18T08:20:08.000ZJ93654J25J115
‘:DEBjncGPlw88CMJ?Luis Carreira 2012 (r.i.p) vs Daniel Hegarty 2017 (r.i.p) crashJmotorsport crashesJ22J2017-11-18T12:34:18.000ZJ9484J10J9
:DEBqHpg70B5I1oJDNew  Eritrean film Dama (á‹³áˆ› ) part  14 Shalom Entertainment 2017JShalom EntertainmentJ22J2017-11-17T13:53:33.000ZJ221666J4012J203
‡:DEBrcN5fASUafgJ9Engel Orakel fÃ¼r die Woche vom 20. bis 26. November 2017JDasEngelOrakelJ1J2017-11-18T09:57:12.000ZJ5331J170J2
“:DEBJ29SRD0ex3EJJSoy Luna 2 - Ãmbar reizt Juliana / Benicio lÃ¤dt den Clip hoch (Folge 58)J	PlaybrushJ1J2017-11-18T13:39:32.000ZJ8466J149J5
s:DEB_SdpVJbeWa0J$Feuerwehren im Landkreis LudwigsburgJAndreas HÃ¤ckerJ28J2017-11-18T08:47:37.000ZJ4283J77J2
i:DEBBgzLDDDnG5oJ"AÅŸk ve Mavi 42. BÃ¶lÃ¼m fragmanÄ±Jefe TvJ22J2017-11-17T21:23:11.000ZJ15902J78J3
j:DEBh-71HfEmav8JRuthe.de - DER BIELEFELD-SONGJruthe.deJ24J2017-11-18T08:55:22.000ZJ49425J3378J241
:DEB0nuW_0SBHooJ'Meteorit Ã¼ber SÃ¼ddeutschland im VideoJSchwÃ¤bische ZeitungJ25J2017-11-15T09:01:32.000ZJ91698J1247J87
µ:DEBRrq-Kt7TK1AJ`Stuttgart vs Borussia Dortmund 2-1 Resumen y Goles / All Goals & Highlights | La Liga 17/11/2017JGoals & highlightsJ17J2017-11-17T23:09:52.000ZJ35334J151J18
¯:DEB1vjIK6f3KSIJcJupp Heynckes stolz im Interview nach 500. Sieg in der Bundesliga I Bayern MÃ¼nchen VS Augsburg 3-0JTIME 4 SPORTJ22J2017-11-18T17:26:58.000ZJ5422J45J3
Š:DEBeyen45zkvlIJ5Daniel Hegarty Fatal Accident Macau GP 2017 Full ViewJFreestyle FootballJ22J2017-11-18T09:57:17.000ZJ129288J24J44
‹:DEByHSXBDS3sO0JBè‡´å‘½æ„å¤–ï¼8è™Ÿèµ«åŠ è¿ªDaniel Hegartyåœ¨æ¼ç¿å½å¤±æ§æ’æ””Jibike99J2J2017-11-18T09:47:15.000ZJ228175J27J64
c:DEBHH0kW2NXFE8JMein Hund gegen Emilia S.JApoGreenJ23J2017-11-18T09:45:04.000ZJ4240J207J16
Œ:DEBRhQaS74hdzAJ>Manchester United vs Newcastle 4-1 Extended Highlights HD 2017JGOALS TVJ22J2017-11-18T19:41:48.000ZJ415984J1669J154
s:DEBxTa4i8r4Tm8J"FT Leicester 0 - 2 Manchester CityJStadium AstroJ17J2017-11-18T20:23:23.000ZJ128922J557J40
…:DEBoSaA3o62eZoJ5Sheldon parents taking Sheldon to family PsychiatristJSheikh MusaJ22J2017-11-17T04:49:27.000ZJ245551J1089J65
:DEBxBFDdGE6jJQJ/Fazilet HanÄ±m ve KÄ±zlarÄ± 24. BÃ¶lÃ¼m FragmanJNastya StolyarenkoJ1J2017-11-18T20:30:00.000ZJ224020J0J0
n:DEB39mivDbyWe8JGlÃ¼cklich verheiratet - 92/17JWitz vom OlliJ24J2017-11-16T06:51:42.000ZJ49650J704J64
¯:DEBImAnTNkIZZMJ\Ø§Ù„Ù‡Ù„Ø§Ù„ Ùˆ Ø§ÙˆØ±Ø§ÙˆØ§ 1-1-  Ø°Ù‡Ø§Ø¨ Ø¯ÙˆØ±ÙŠ Ø£Ø¨Ø·Ø§Ù„ Ø¢Ø³ÙŠØ§ 2017 Ø§Ù„Ù†Ù‡Ø§Ø¦ÙŠJ
Ù…Ø¨Ø§Ø´Ø±J20J2017-11-18T17:51:02.000ZJ1587097J12579J1245
¤:DEBt7vmJbQyO28JFRainbow Six Pro League Finals - Season 3 - Live from Sao Paulo - Day 1JRainbow Six Pro LeagueJ20J2017-11-06T19:01:07.000ZJ638771J15306J1058
•:DEBu9_xgH1fTc0JM18 á‰€á‹³áˆ áˆµá‹µáˆ« 18 áˆ•á‹³áˆ­ 21017 /// Eritrean Movie sidra 4 Nov 2017JDehayJ24J2017-11-18T13:07:33.000ZJ15879J291J14
j:DEBc6adP64QDMIJ tagesschau 20:00 Uhr, 18.11.2017J
tagesschauJ25J2017-11-18T19:52:22.000ZJ2872J50J5
½:DEBnz45DMMcjPsJdAndre bekommt einen gebl*sen?? Kim wird doch weiter gemobbt? Vorschau Berlin Tag & Nacht 20.11-24.11JBerlin Tag & NachtJ22J2017-11-17T19:04:10.000ZJ376461J2075J1574
ƒ:DEBUrb6dkR-pasJ/Sturm der Liebe Vorschau fÃ¼r Folge 2813 - 2817JSturm der Liebeâ™¥J22J2017-11-19T11:00:02.000ZJ15493J109J6
“:DEBDY7vA_OuF2oJ?Huge pile up - Crash - 2017 Macau Grand Prix - FIA GT World CupJWeber NiraschtoeJ17J2017-11-18T05:19:37.000ZJ432274J728J22
µ:DEBRrq-Kt7TK1AJ`Stuttgart vs Borussia Dortmund 2-1 Resumen y Goles / All Goals & Highlights | La Liga 17/11/2017JGoals & highlightsJ17J2017-11-17T23:09:52.000ZJ51321J206J30
l:DEB08ZIZNOhuTcJ!Presseclub - Sendung vom 19.11.17J
Freak AKidJ24J2017-11-19T11:57:04.000ZJ6090J18J17
:DEB0uTGy7cWdvIJ1Fazilet HanÄ±m ve KÄ±zlarÄ± 24  BoÌˆluÌˆm FragmanJErkan AkkayaJ24J2017-11-19T09:54:21.000ZJ53858J208J9
m:DEBmnXnLeo54FAJBVG â€“ Ohne UnsJWeil wir dich liebenJ24J2017-11-15T09:00:19.000ZJ2624022J16934J1764
n:DEBgFMEJNwfyOsJ!King of Queens Das verkaufte GrabJAdem KorkmazJ22J2017-11-18T21:11:53.000ZJ13973J46J2
£:DEBMnsaVxNnRhUJFRainbow Six Pro League Finals - Season 3 - Live from Sao Paulo - Day 2JRainbow Six Pro LeagueJ20J2017-11-20T08:07:29.000ZJ598897J15570J407
É:DEB30dBiIHYXoIJ€áŠ£á‰¥ áŠ£áˆ°áŠ•á‰£á‹² á‰³áˆªáŠ½ áŠ¥á‰µáŠá‰¥áˆ­ áŒ‹áˆ 62 á‹“áˆ˜á‰µ áŠ¤áˆ­á‰µáˆ«á‹Šá‰µ áŠ£á‹° /// Eritrean mother with amazing JDehayJ24J2017-11-19T12:05:30.000ZJ26654J416J22
“:DEBrsCgCk-0nskJDDolunay 20. BÃ¶lÃ¼m - Ferit ve NazlÄ± Ã–pÃ¼ÅŸÃ¼yor - Romantik Anlar!JDizi AdamÄ±J22J2017-11-19T19:23:45.000ZJ147067J648J19
:DEBcw3AaVD_xm8J;Seltene FENDT-RÃ¼ben-Vollernter (demo) Grasernte 1960-1970.JYoungtimer TractorsJ2J2017-11-19T11:36:27.000ZJ6689J49J3
[:DEB9UMaQVjUISgJWitze-Mix 35JNizarComedyJ24J2017-11-19T17:00:00.000ZJ38034J1893J21
b:DEBhwHjTR1L2hUJVor Ort - 20.11.17 09:00J
Freak AKidJ24J2017-11-20T14:15:14.000ZJ5353J23J7
:DEBe-iQLj5jWngJ$Folge 2813: Demenz | Sturm der LiebeJSturm der Liebe OfficialJ24J2017-11-20T14:10:01.000ZJ56912J769J30
:DEB2uFSOJAs370J9Star Wars The Clone Wars Wiederbelebung der Toten Teil 16JStar Wars Clips DeutschJ22J2017-11-20T17:06:56.000ZJ3308J24J2
—:DEBpcoBE-6SFsAJ:Soy Luna 2 - Clip: Juliana taucht doch noch auf (Folge 60)JVidNer123/Soy Luna 2 - ClipsJ22J2017-11-20T09:38:42.000ZJ7182J161J2
›:DEB0bdLFSAWOnQJNØ¨Ø±Ù†Ø§Ù…Ø¬ Take Me Out Ù†Ù‚Ø´Øª - Ø§Ù„Ù…ÙˆØ³Ù… 2 - Ø§Ù„Ø­Ù„Ù‚Ø© 2 ÙƒØ§Ù…Ù„Ø©JOn HiTsJ22J2017-11-19T22:05:13.000ZJ299429J1923J482
¯:DEBiG9iycKRoj8JaStellungnahme Pflegemutter, es war ihr Wunsch Ã¼ber Jens Lachenmayr / keine Neuwahlen (Videotext)JAntje SophiaJ22J2017-11-20T14:25:01.000ZJ6086J198J24
›:DEBa3AefTrmyuUJORasim Ozan KÃ¼tahyalÄ± CanlÄ± YayÄ±nda KusturmalÄ± BoÅŸnak Saksosu Beyaz FutbolJLOXESKAMJ22J2017-11-19T21:53:20.000ZJ96340J158J109
…:DEBhio0FAAc75QJ0Nur YerlitaÅŸ bombaladÄ± sosyal medya karÄ±ÅŸtÄ±JSÃ¶ylemezsem OlmazJ22J2017-11-20T08:21:09.000ZJ38263J134J27
³:DEBibmB1AbZjW4JcØªÙˆØ¶ÛŒØ­ Ù…Ø­Ù…Ø¯ Ù†ÙˆØ±ÛŒØ²Ø§Ø¯ Ø¯Ø± Ù…ÙˆØ±Ø¯ Ø¨Ø¯Ù„ Ø®Ø§Ù…Ù†Ù‡ Ø§ÛŒ Ø¨Ù‡ Ù†Ø§Ù… Ù…ÛŒØ± Ø·Ø§Ù‡Ø±JFreegate NewsJ25J2017-11-20T15:14:53.000ZJ34465J109J56
|:DEBhQcSIUYhZccJ*Jamaika geplatzt: Willkommen in Weimar 2.0JEmperor CaligulaJ24J2017-11-20T14:40:22.000ZJ4287J237J12
¦:DEBq0ziftydM2MJSSÃ¶z 22.BÃ¶lÃ¼m - Yavuz Silah Ã§ektiÄŸiniz kiÅŸi bir TÃ¼rk askeri!(Feyzullah ve Su)JSÃ–Z Vatan SaÄŸolsunJ1J2017-11-20T19:41:01.000ZJ8324J66J6
l:DEBEuqbHMB99FwJUcho Prezesa zwiastun odc. 26JUchoPrezesaJ1J2017-11-20T07:00:01.000ZJ143821J1921J70
™:DEBh0B64xiXdbcJKHÃ¶rt mal wie Marietta Slomka mit Christian Lindner umgeht ! Muss das sein?J
Info KanalJ22J2017-11-21T09:06:35.000ZJ67910J808J201
®:DEB1dXJzeAFNSIJ]Fulminante Rede von Alice Weidel im Bundestag AfD fordert Klage gegen EZB Programm AfD BerlinJAFD-TelevisionJ29J2017-11-21T17:18:38.000ZJ10587J573J40
|:DEBu5IZhPc5fjUJ)Folge 2549: Neu durchstarten | Rote RosenJRote Rosen OfficialJ24J2017-11-20T13:10:01.000ZJ7098J96J1
—:DEBAOGvTjto-4YJ<Folge 2814: Vorbereitungen fÃ¼r die Flucht | Sturm der LiebeJSturm der Liebe OfficialJ24J2017-11-21T14:10:02.000ZJ67936J925J45
›:DEB1dLI4i0rykcJOAndre's Ex Freundin? Mucki's Halstuch! Vorschau 21.11.17 - Berlin Tag und NachtJ
unnÃ¶tig21J22J2017-11-21T19:26:18.000ZJ11995J112J5
‰:DEBwBtUitZAdP0J?Andreas Martin: Was passierte wirklich mit seiner Frau Juliane?JTop NewsJ25J2017-11-21T15:50:12.000ZJ15762J48J13
¯:DEBn48TqiD_58sJVWWE Monday Night RAW 11/20/2017 Highlights HD - WWE RAW 20 november 2017 Highlights HDJClassy WrestlingJ17J2017-11-21T06:01:26.000ZJ1425542J12001J1059
°:DEBT1EcJWBYO-0JVWWE RAW 20 November 2017 Highlights HD - WWE Monday Night Raw 20/11/2017 Highlights HDJWrestling Reality IIJ17J2017-11-21T12:24:06.000ZJ592583J4392J351
€:DEBVV6D3kY_3W8J0Sturm der Liebe Vorschau fÃ¼r Folge 2814 -  2818Jsturmderliebe99J24J2017-11-20T21:49:43.000ZJ22878J93J6
m:DEBm5JC-AUbuUYJ tagesschau 20:00 Uhr, 20.11.2017J
tagesschauJ25J2017-11-20T19:45:24.000ZJ10381J144J12
¶:DEBAgHe1dH9id0J\ĞĞĞ’Ğ˜ĞĞšĞ Ğ¤Ğ˜Ğ›Ğ¬Ğœ ĞŸĞ•Ğ Ğ’ĞĞ¯ Ğ›Ğ®Ğ‘ĞĞ’Ğ¬ (2017) Ğ Ğ£Ğ¡Ğ¡ĞšĞĞ¯ ĞœĞ•Ğ›ĞĞ”Ğ ĞĞœĞJĞ”Ğ°Ğ½Ñ ĞšĞ°Ñ€Ğ¿Ğ¾Ğ²J24J2017-11-21T12:19:08.000ZJ104452J284J126
‚:DEBBo6sEPMM67kJ4ICH HABE 95 MARADONA IM WEEKEND LEAGUE TEAM ğŸŒŸğŸŒŸJproownezJ20J2017-11-21T16:42:11.000ZJ167378J9112J137
„:DEBMg_plKOth8EJ/Ece Erken: GÃ¼lben bana zamanÄ±nda neler yaptÄ±JSÃ¶ylemezsem OlmazJ22J2017-11-21T09:45:22.000ZJ55066J197J50
»:DEBFN-oM22ytYcJdBehind The Scenes of Justin Bieber German T-Mobile commercial Deutsche Telekomâ€™s StreamOn campaignJJustin Bieber VideosJ22J2017-11-21T16:51:47.000ZJ14931J670J15
|:DEBuperffDjXAMJ,Rasim Ozan KÃ¼tahyalÄ± Beyaz TV'den kovuldu!JHabererk TVJ25J2017-11-20T21:21:25.000ZJ216295J404J531
–:DEBnW8U49extXkJ=ğŸ’¯Klara spielt ein FALSCHES SpielğŸ™„ |Berlin Tag und NachtJKÃ¶ln 50667 BTN Exklusiv!J22J2017-11-21T18:40:35.000ZJ3382J41J4
˜:DEB1LvHX127qRwJMApoel Nicossia vs Real Madrid 0-6 - All Goals & Highlights - 21 November 2017JIuonakJ17J2017-11-21T21:16:03.000ZJ230920J696J343
y:DEB9aKgpRzo_iwJ"Siyah Beyaz AÅŸk 7.BÃ¶lÃ¼m FragmanJMeraklÄ± DizikolikJ22J2017-11-21T13:47:16.000ZJ213197J646J101
y:DEBa_mCcJv9nBQJ0Feiertags Strategie â€“ vor Thanksgiving kaufen?J	Jens RabeJ27J2017-11-21T15:00:01.000ZJ3156J99J5
–:DEBaa1JB2ZPomIJCWie geht es Ihm? Wie fÃ¼hlt er fÃ¼r dich? Was kann du tun fÃ¼r Ihn?JAnnas Home of LoveJ22J2017-11-21T19:07:30.000ZJ2916J100J8
¥:DEBpSv9gjPG0kMJWBoston Celtics vs Dallas Mavericks - Full Game Highlights | Nov 20 | 2017-18 NBA SeasonJNBA KitJ17J2017-11-21T04:15:11.000ZJ1060731J3876J232
œ:DEBa3AefTrmyuUJORasim Ozan KÃ¼tahyalÄ± CanlÄ± YayÄ±nda KusturmalÄ± BoÅŸnak Saksosu Beyaz FutbolJLOXESKAMJ22J2017-11-19T21:53:20.000ZJ169487J260J168
‘:DEBvMbxsfCMSo8J@Gegenrede zu AfD-Antrag RechtmÃ¤ÃŸigkeit der Euro-StabilisierungJManuel SarrazinJ25J2017-11-21T17:22:48.000ZJ9207J83J113
\:DEBH3FMKqeZjUIJSlomka vs. LindnerJAxel FunkenJ24J2017-11-21T17:52:24.000ZJ1827J4J0
›:DEBh0B64xiXdbcJKHÃ¶rt mal wie Marietta Slomka mit Christian Lindner umgeht ! Muss das sein?J
Info KanalJ22J2017-11-21T09:06:35.000ZJ206689J3968J884
:DEBDXe5quUQTyMJ&LIVE: Holocaust-Mahnmal besucht HÃ¶ckeJ"Zentrum fÃ¼r Politische SchÃ¶nheitJ25J2017-11-22T06:58:05.000ZJ60880J762J1196
¼:DEBFN-oM22ytYcJdBehind The Scenes of Justin Bieber German T-Mobile commercial Deutsche Telekomâ€™s StreamOn campaignJJustin Bieber VideosJ22J2017-11-21T16:51:47.000ZJ49605J1303J40
Œ:DEBTz6y296bJOQJ1Folge 2815: Mord im FÃ¼rstenhof | Sturm der LiebeJSturm der Liebe OfficialJ24J2017-11-22T14:10:02.000ZJ58007J816J23
ƒ:DEBBCcI4IeHQ6gJ/Folge 2550: Eine gute Journalistin | Rote RosenJRote Rosen OfficialJ24J2017-11-22T13:10:02.000ZJ8705J115J4
§:DEBsIryfJ9Mwr4JYUltras Chemie Leipzig vs. 1.FC Lokomotive Leipzig!! Support, choreo and Pyro!! 22.11.2017JSqueezer DripsJ17J2017-11-22T16:34:33.000ZJ6175J7J12
l:DEB-aaSzzNBJzsJ tagesschau 20:00 Uhr, 21.11.2017J
tagesschauJ25J2017-11-21T20:29:56.000ZJ8682J101J11
£:DEBt9b5hVmxPLEJNNihat DoÄŸan Ã§Ä±ldÄ±rdÄ±! Benden baÅŸka KÃ¼rtlÃ¼ÄŸÃ¼ ile gurur duyan adam yokJSÃ¶ylemezsem OlmazJ22J2017-11-22T08:39:43.000ZJ21507J112J40
‚:DEBslRj7aweWQ0J&typischdennis / Vorteile eines SINGLESJFacebook Videos auf You TubeJ22J2017-11-21T19:11:31.000ZJ19024J0J0
t:DEBw3quZja2r1EJ(Yemekteyiz 58. BÃ¶lÃ¼m - CanlÄ± YayÄ±nÄ±J
YemekteyizJ24J2017-11-22T13:04:40.000ZJ30008J90J30
œ:DEBs7B2qllotvUJHPaula Ã¼bt einen Mordversuch auf Mandy aus!!! | Berlin Tag & Nacht #1570JBerlinTagUndNachtJ22J2017-11-22T18:23:08.000ZJ66401J561J29
‡:DEBg-XBDvMWd1oJ3Stephen Colbert monologue 11/21/17 : Charlie Goes !JFederica BalsamoJ22J2017-11-22T05:01:29.000ZJ145027J535J95
Œ:DEBgfDIiGD_Fs4JNeu im Dezember | DeutschlandJ,Netflix Deutschland, Ã–sterreich und SchweizJ24J2017-11-22T19:19:23.000ZJ11700J626J29
œ:DEBh0B64xiXdbcJKHÃ¶rt mal wie Marietta Slomka mit Christian Lindner umgeht ! Muss das sein?J
Info KanalJ22J2017-11-21T09:06:35.000ZJ336108J6757J1620
‘:DEBReUK2fv3XAgJ6Folge 2816: Kampf um den FÃ¼rstenhof | Sturm der LiebeJSturm der Liebe OfficialJ24J2017-11-23T14:10:01.000ZJ56112J779J29
}:DEBfetsl6dhkZgJ(Markus Lanz vom 22. November 2017 Â© ZDFJMarkus Lanz FanclubJ24J2017-11-23T09:32:39.000ZJ14038J79J34
k:DEBfdb24zll-9MJKing of Queens Der PausenclownJAdem KorkmazJ22J2017-11-22T16:28:09.000ZJ18352J34J5
‰:DEBAxcIRSyzoE0J6Dualseelen/Seelenpartner Orakel vom  23.11.-30.11.2017JAnnas Home of LoveJ22J2017-11-23T15:21:30.000ZJ3826J152J3
ƒ:DEByvZnMoAFWEUJ0Folge 2551: Der VersÃ¶hnungsversuch | Rote RosenJRote Rosen OfficialJ24J2017-11-23T13:10:02.000ZJ7945J96J1
“:DEBhEiBQ7pD3CcJ7Soy Luna 2 - Clip: Vorschau auf Folge 65 (aus Folge 64)JVidNer123/Soy Luna 2 - ClipsJ22J2017-11-23T19:04:57.000ZJ3060J80J0
u:DEBJvlmvyZ7k2QJ(Yemekteyiz 59. BÃ¶lÃ¼m - CanlÄ± YayÄ±nÄ±J
YemekteyizJ24J2017-11-23T13:10:45.000ZJ41699J124J31
±:DEBENZYxdKFPn0J_Golden State Warriors vs OKC Thunder - Full Game Highlights | Nov 22, 2017 | 2017-18 NBA SeasonJXimo PiertoJ17J2017-11-23T03:35:06.000ZJ1333050J8602J356
¹:DEBSN8h92vWkx8JeJustin Bieber - Friends [Official Music Video] [Full] German T-Mobile commercial Deutsche Telekomâ€™sJAndrÃ©VideosVEVOBRJ10J2017-11-23T02:22:47.000ZJ18298J999J5
k:DEBb0a6b19aYRMJ tagesschau 20:00 Uhr, 22.11.2017J
tagesschauJ25J2017-11-22T19:49:51.000ZJ8504J93J11
¡:DEBdrRq3edjINMJXSong:Bum bum granada remix ğŸ’¥ğŸ’¥ğŸ’¥// Official dancevideo by @anesgreku & yesenia_ozJ	A&Y DanceJ22J2017-11-23T19:57:43.000ZJ1659J58J3
i:DEB0BqNjC28kbMJKABA'S DEATH:THE SPIRITUAL SIDEJKOFI TVJ23J2017-11-22T23:00:09.000ZJ61150J403J60
v:DEBTQV4rOghf18J%Andre !!? Â¦ Berlin Tag & Nacht #1570JBerlinTagUndNachtJ22J2017-11-22T19:25:33.000ZJ8028J32J1
~:DEBbHDJIf7ceO8J,Siyah Beyaz AÅŸk 7  BÃ¶lÃ¼m GeniÅŸ FraÄŸman.JErkan AkkayaJ24J2017-11-22T16:20:04.000ZJ496422J3547J106
€:DEBEI27Yzsb4NcJ6Michael Schumacher: Dramatischer Appell seiner TochterJTop NewsJ25J2017-11-23T12:39:24.000ZJ11800J32J47
­:DEB3A-9pU1-040JY1. FC Lokomotive Leipzig 0:0 BSG Chemie Leipzig 22.11.2017 | Chroeos, Pyroshows & SupportJKurven des OstensJ17J2017-11-23T13:25:14.000ZJ15824J354J17
‘:DEBqQTVuRrZO8wJ4Primitive Technology: New area starting from scratchJPrimitive TechnologyJ22J2017-11-24T21:03:09.000ZJ1783347J111683J747
œ:DEBh0B64xiXdbcJKHÃ¶rt mal wie Marietta Slomka mit Christian Lindner umgeht ! Muss das sein?J
Info KanalJ22J2017-11-21T09:06:35.000ZJ409013J7649J1896
}:DEBgfTg5pgZz8cJ(Markus Lanz vom 23. November 2017 Â© ZDFJMarkus Lanz FanclubJ24J2017-11-24T00:54:14.000ZJ25314J78J64
~:DEBtZdb9c9ZLukJ&FuÃŸball Challenge im STADION ğŸ˜³ğŸ˜±JConCrafter | LUCAJ24J2017-11-24T16:25:23.000ZJ153190J14717J391
ƒ:DEBJsuuk3SQ5FgJ4Sheldon got B grade in his exam -Young Sheldon S1EP5JSheikh MusaJ22J2017-11-24T18:20:24.000ZJ103109J565J20
¾:DEBTeuZBGSKf0IJ@DIY: sÃ¼ÃŸe Weihnachtsdeko im Bilderrahmen [How to] Deko KitchenJ;Deko Kitchen â€“ SchÃ¶ne Deko selber machen | Esther StraubJ26J2017-11-24T09:46:26.000ZJ12525J766J11
•:DEBSWZt8CZifxoJ:Folge 2817: Schuld aus der Vergangenheit | Sturm der LiebeJSturm der Liebe OfficialJ24J2017-11-24T14:10:02.000ZJ49571J730J31
x:DEBzh1Yv0kCI9cJ+King of Queens Carrie auf dem Weg nach obenJAdem KorkmazJ22J2017-11-23T17:06:39.000ZJ16961J56J7
y:DEBKIwaCcSfntcJ&Folge 2552: Der HÃ¶rsturz | Rote RosenJRote Rosen OfficialJ24J2017-11-24T13:10:02.000ZJ7050J85J4
`:DEBpVvSnIlpY48JStimmen nach ArsenalJ1. FC KÃ¶lnJ17J2017-11-24T11:17:47.000ZJ4758J301J3
¡:DEBncu-8d75FZQJWNIKAD STRAÅ NIJI DOGAÄAJ U ZADRUZI ! Miki pokuÅ¡ao da ubije Lepog MiÄ‡u ( CEO SNIMAK )JMerkizzJ24J2017-11-24T14:16:33.000ZJ60790J190J20
¨:DEByLeQuz8YzIsJOTOKOMI WAPI du 24 11 2017 NINI EKOMELI J MARC KABUND, FELIX TSHISEKEDI PE ALOBIJNDEKO ELIEZER TOKOKOMAJ22J2017-11-24T15:08:20.000ZJ35640J467J39
˜:DEBNJ455rDsPfQJ5AdÄ±nÄ± Sen Koy 226-227.bÃ¶lÃ¼m fragmanÄ±ğŸ˜²ğŸ˜²ğŸ˜²J ADINI SEN KOY ASK_ZEHOM_AÄ°LESÄ°J22J2017-11-24T16:04:17.000ZJ83775J565J14
Ö:DEBAHAFmGtNdlMJ€Ø§Ø±Ø¯ÙˆØºØ§Ù† ÙŠÙ…Ù‡Ø¯ Ø±Ø³Ù…ÙŠØ§ Ù„Ù„Ù‚Ø§Ø¡ Ø§Ù„Ø£Ø³Ø¯.. Ù…ØªÙ‰ Ù†Ø±Ø§Ù‡ Ù…ØµÙ„ÙŠØ§ ÙÙŠ Ø§Ù„Ø¬Ø§Ù…Ø¹ Ø§Ù„Ø§Ù…ÙˆÙŠØŸ ÙˆÙ…Ø§ Ù‡JAbdel Bari AtwanJ25J2017-11-24T15:32:51.000ZJ33694J1647J191
‡:DEBH3FCopFGdZMJ5Kim ist DrogenabhÃ¤ngig?! Â¦ Berlin Tag & Nacht #1573JBerlinTagUndNachtJ22J2017-11-24T21:18:14.000ZJ10133J56J3
j:DEBj4AaTDHYNW4J tagesschau 20:00 Uhr, 24.11.2017J
tagesschauJ25J2017-11-24T20:08:19.000ZJ3214J56J6
 :DEB-AhLm-PkOYUJQBorussia Dortmund 4 x 4 Schalke 04 - Melhores Momentos - C. AlemÃ£o 25/11/2017 HDJ	Lances HDJ22J2017-11-25T22:19:06.000ZJ233672J5413J242
’:DEBqQTVuRrZO8wJ4Primitive Technology: New area starting from scratchJPrimitive TechnologyJ22J2017-11-24T21:03:09.000ZJ4026193J168203J1448
„:DEBJsuuk3SQ5FgJ4Sheldon got B grade in his exam -Young Sheldon S1EP5JSheikh MusaJ22J2017-11-24T18:20:24.000ZJ219074J1082J88
²:DEBEbICuOMyjGkJcRalf FÃ¤hrmann provoziert BVB Fans & Nuri Sahin stoppt ihn I Rudelbildung @ Dortmund VS Schalke 4-4JTIME 4 SPORTJ22J2017-11-25T18:38:08.000ZJ26626J137J12
:DEBog3oaLAeZLEJ4Eritrean film dama part 15 shalom entertainment 2017JShalom EntertainmentJ22J2017-11-25T09:02:49.000ZJ178865J3771J192
¥:DEBwjzcca3yaQYJRStephen Colbert 11/25/2017 The Age of Trump Openly Campaigning For Trump's DwnfallJPolitics NewsJ25J2017-11-25T07:26:44.000ZJ218496J1296J261
}:DEBgfTg5pgZz8cJ(Markus Lanz vom 23. November 2017 Â© ZDFJMarkus Lanz FanclubJ24J2017-11-24T00:54:14.000ZJ34593J96J96
~:DEBtZdb9c9ZLukJ&FuÃŸball Challenge im STADION ğŸ˜³ğŸ˜±JConCrafter | LUCAJ24J2017-11-24T16:25:23.000ZJ223512J18191J589
:DEBKYMY_TZw3FIJ6Dualseelen/Wunschpartner Liebesorakel - Der StandpunktJLuna Maries SeelenblickJ22J2017-11-25T17:34:13.000ZJ2800J126J6
¼:DEBKF5ICTF1nl0JtIch wÃ¼nsche dir ein Tag ğŸƒğŸŒ»ğŸƒvoller FrÃ¶hlichkeit und HarmonieğŸƒğŸŒ¹ğŸƒLiebe GrÃ¼ÃŸe von mir ğŸƒğŸŒ¼ğŸƒJ
Nate ZoobeJ1J2017-11-25T08:35:11.000ZJ7531J0J0
©:DEBaO2Bth4t3PcJ_Dortmund vs Schalke 4-4  - Goretzka und FÃ¤hrmann im Interview Ã¼ber Rudelbildung nach Abpfiff!J
Sport TimeJ17J2017-11-25T17:59:20.000ZJ4610J26J3
œ:DEBh0B64xiXdbcJKHÃ¶rt mal wie Marietta Slomka mit Christian Lindner umgeht ! Muss das sein?J
Info KanalJ22J2017-11-21T09:06:35.000ZJ471615J8020J2000
ª:DEBWnUMWbNUFLIJ]Ù…Ø¨Ø§Ø±Ø§Ø© Ø§Ù„Ù‡Ù„Ø§Ù„ ÙˆØ§ÙˆØ±Ø§ÙˆØ§ Ø±ÙŠØ¯ Ø¯ÙŠØ§Ù…ÙˆÙ†Ø¯Ø² | Ù…ÙˆÙ‚Ø¹ ØªØ§Ø¨Ø¹ ÙƒÙˆØ±Ø©JAdminJ17J2017-11-25T14:08:32.000ZJ1112221J5324J2047
:DEBdEFXCZDpu7IJ<Pascal und Nik zeigen MitgefÃ¼hl Â¦ Berlin Tag & Nacht #1573JBerlinTagUndNachtJ22J2017-11-24T21:14:14.000ZJ63682J518J23
:DEBRTEX842RypUJHCaptain smart and some workers  at multimedia are Hypocristes - IdeasmanJBigscout Nana PrempehJ2J2017-11-25T18:10:41.000ZJ15965J49J28
j:DEByb0InmzcvWEJ tagesschau 20:00 Uhr, 25.11.2017J
tagesschauJ25J2017-11-25T19:42:16.000ZJ3362J63J9
…:DEBZ8LcKGvs3kIJ8S P KOFI SARPONG PERFORMS AT KABA'S ONE WEEK CELEBRATIONJEMMANUEL ABJ22J2017-11-25T11:16:05.000ZJ41621J90J19
q:DEBYeMH0S1jTuwJ%Î¦Î©Î£ Î£Î¤ÎŸ Î¤ÎŸÎ¥ÎÎ•Î› 24/11/2017J	Vasilis NJ22J2017-11-25T09:30:17.000ZJ24181J172J30
†:DEBXgNiX3hoSY4J;KABA's Wife Cries So Much at Husband's One Week CelebrationJ	GhanaTubeJ25J2017-11-25T10:03:40.000ZJ44180J89J35
¾:DEBTeuZBGSKf0IJ@DIY: sÃ¼ÃŸe Weihnachtsdeko im Bilderrahmen [How to] Deko KitchenJ;Deko Kitchen â€“ SchÃ¶ne Deko selber machen | Esther StraubJ26J2017-11-24T09:46:26.000ZJ17928J941J14
:DEBEElJZK5ceoMJ;Ø¨Ø« Ù…Ø¨Ø§Ø´Ø± Ø§Ù„Ù‡Ù„Ø§Ù„ Ã— Ø§ÙˆØ±ÙˆØ§ Ø§Ù„ÙŠØ§Ø¨Ø§Ù†ÙŠJsaadalfeeshJ22J2017-11-25T12:47:33.000ZJ529278J3814J2406
Í:DEBUkaeCV2uuyMJ{Ù…Ù„Ø®Øµ Ù…Ø¨Ø§Ø±Ø§Ø© Ø±ÙŠØ§Ù„ Ù…Ø¯Ø±ÙŠØ¯ ÙˆÙ…Ù„Ù‚Ø§ 3-2 - Ù…Ø¨Ø§Ø±Ø§Ø© Ù…Ø¬Ù†ÙˆÙ†Ø© Ø¬Ø¯Ø§ - Ø§Ù„Ø¯ÙˆØ±Ù‰ Ø§Ù„Ø§Ø³Ø¨Ø§Ù†Ù‰J	Mr.AssistJ17J2017-11-25T17:03:15.000ZJ1466983J13614J1243
•:DEBM73qRw35gBAJJBorussia Dortmund vs. Schalke 04, 94. Minute Naldo 4:4 live im Stadion !!!Jhamude83J17J2017-11-26T10:27:15.000ZJ54593J730J67
Ò:DEBTcLwpKacUagJÙ…Ø´Ø§Ù‡Ø¯Ø© Ù…Ø¨Ø§Ø±Ø§Ø© Ø¨Ø±Ø´Ù„ÙˆÙ†Ø© ÙˆÙØ§Ù„Ù†Ø³ÙŠØ§ Ø¨Ø« Ù…Ø¨Ø§Ø´Ø± Ø¨ØªØ§Ø±ÙŠØ® 26-11-2017 Ø§Ù„Ø¯ÙˆØ±ÙŠ Ø§Ù„Ø§Ø³Ø¨Ø§Ù†ÙŠJMohamdAssi TvJ17J2017-11-26T22:49:17.000ZJ604821J5937J454
t:DEB-01JK3TRtIoJ*Ã‡ocuklar DuymasÄ±n | 18.BÃ¶lÃ¼m 1.FragmanJPlayJ22J2017-11-26T20:24:41.000ZJ326241J1148J124
…:DEBJsuuk3SQ5FgJ4Sheldon got B grade in his exam -Young Sheldon S1EP5JSheikh MusaJ22J2017-11-24T18:20:24.000ZJ292166J1483J140
~:DEBkHTOkac84EwJ1TRAUMKARRE anschmeiÃŸen & ab nach Arizona heizen!J	FlipFloidJ22J2017-11-26T20:15:32.000ZJ24322J2264J34
Å:DEB_TixdNYZuFIJwAlena TV -Tesfit Abraha - Dgul Hiyab - Part - 5  (á‹µáŒ‰áˆ áˆ…á‹«á‰¥  áˆ“áˆáˆ»á‹­ áŠ­á‹áˆ)- New Eritrean Movie 2017JAlena TVJ24J2017-11-26T12:36:29.000ZJ156219J4595J285
°:DEB4X-RCg7ZFq8JaSportschau Kommentator rastet beim Ausgleichstor von Naldo komplett aus I Dortmund VS Schalke 4-4JTIME 4 SPORTJ22J2017-11-26T10:44:47.000ZJ60921J297J43
€:DEBkhkjHzgcA3kJ0Sturm der Liebe Vorschau fÃ¼r Folge 2819 -  2823Jsturmderliebe99J24J2017-11-26T11:13:05.000ZJ11314J68J3
’:DEBqQTVuRrZO8wJ4Primitive Technology: New area starting from scratchJPrimitive TechnologyJ22J2017-11-24T21:03:09.000ZJ4586840J181705J1621
d:DEB4_i3IuB3EbwJGladbach vs Bayern 2:1Jmarkus konrathJ23J2017-11-26T04:56:19.000ZJ6986J26J5
w:DEBaHf3-BdeU7oJ(Das 4:4  BVB vs. SCHALKE 04 aus Block 45JMrEdelsachseJ17J2017-11-25T20:29:53.000ZJ40196J274J13
}:DEBTtlg84vyZHQJ3Funktioniert Buy & Hold noch? Teil 2 RechenbeispielJ	Jens RabeJ27J2017-11-26T07:30:00.000ZJ5660J364J6
Ÿ:DEB1cG1G3Cno54JQĞ¡ĞµÑ€Ğ³ĞµĞ¹ ĞšĞ¾Ğ²Ğ°Ğ»ĞµĞ²-Ğ’ÑÑ‡ĞµÑĞ»Ğ°Ğ² Ğ¨Ğ°Ğ±Ñ€Ğ°Ğ½ÑĞºĞ¸Ğ¹ HD ĞĞĞšĞĞ£Ğ¢JmustacheJ22J2017-11-26T05:24:55.000ZJ695745J6525J604
f:DEBGCTMkt2EzBYJS.O.S   Wie geht es weiter?JAntje SophiaJ22J2017-11-26T20:19:32.000ZJ5631J0J0
n:DEBjhA7tmxuu-cJ TRENNUNG VON YAVITV ğŸ˜±ğŸ˜±ğŸ˜±JHassuna VegetaJ22J2017-11-26T20:54:28.000ZJ2214J89J3
•:DEBlY0ckUBVerAJ@4:4 im Revier-Derby - So feierte der Schalker Anhang in DortmundJTobias WeckenbrockJ17J2017-11-25T21:06:22.000ZJ94152J514J75
š:DEBN_rJCeZw0okJEBosca feat. Vega, Hanybal, Celo & Abdi - 20 Jahre UF (Official Audio)JfreundevonniemandJ24J2017-11-26T18:31:51.000ZJ25573J1493J30
{:DEBbFpRkIEguRwJ3SKY REPORTER VOR ORT IN DORTMUND NACH SCHALKE SPIELJFootballJ17J2017-11-26T12:34:13.000ZJ5067J22J0
Š:DEBpuekU2WRSW0J<Dortmund vs Schalke 4:4 goals [Aubameyang red card] 25.11.17JPierre MagdziakJ22J2017-11-25T23:39:27.000ZJ4508J5J2
¥:DEBwjzcca3yaQYJRStephen Colbert 11/25/2017 The Age of Trump Openly Campaigning For Trump's DwnfallJPolitics NewsJ25J2017-11-25T07:26:44.000ZJ373583J1958J438
:DEBr2DtCqySmgQJB2017 11 25 Gruss von der Compact-Konferenz in Leipzig Sven LiebichJ
Svens WeltJ25J2017-11-26T08:51:48.000ZJ5763J473J15
:DEBEGw0RVwZAPsJ/Sturm der Liebe Vorschau fÃ¼r Folge 2818 - 2822JSturm der Liebeâ™¥J22J2017-11-26T13:00:00.000ZJ7595J69J0
k:DEBPvoLi859GV4J Anne Will - Sendung vom 26.11.17J
Freak AKidJ24J2017-11-26T22:06:19.000ZJ5011J15J13
l:DEBXaO6usQ-iG0J!FOOD DIARY| Nutella Berliner ğŸ«J
Isas BloogJ22J2017-11-26T11:52:44.000ZJ2536J133J2
n:DEBI_oB8ZABiukJ Haben sie das schon mal gesehen?JLewitzerpoonyJ15J2017-11-26T19:32:05.000ZJ2034J525J7
:DEBog3oaLAeZLEJ4Eritrean film dama part 15 shalom entertainment 2017JShalom EntertainmentJ22J2017-11-25T09:02:49.000ZJ221912J4167J240
˜:DEBM73qRw35gBAJJBorussia Dortmund vs. Schalke 04, 94. Minute Naldo 4:4 live im Stadion !!!Jhamude83J17J2017-11-26T10:27:15.000ZJ133315J2501J286
²:DEB4X-RCg7ZFq8JaSportschau Kommentator rastet beim Ausgleichstor von Naldo komplett aus I Dortmund VS Schalke 4-4JTIME 4 SPORTJ22J2017-11-26T10:44:47.000ZJ104195J631J141
‡:DEBqY7eomoozP4J,Folge 2818: Die Verhaftung | Sturm der LiebeJSturm der Liebe OfficialJ24J2017-11-27T14:10:02.000ZJ54302J840J28
~:DEBkHTOkac84EwJ1TRAUMKARRE anschmeiÃŸen & ab nach Arizona heizen!J	FlipFloidJ22J2017-11-26T20:15:32.000ZJ44480J3337J90
’:DEBTWpc5hCb7gIJ>Levent YÃ¼ksel ve sevgilisi magazin dÃ¼nyasÄ±nÄ± ikiye bÃ¶ldÃ¼JSÃ¶ylemezsem OlmazJ22J2017-11-27T11:09:35.000ZJ28176J81J21
¨:DEBwGRL0O15xP4JSPrince Harry and Meghan Markle interviewed on the day their engagement is announcedJThe Royal FamilyJ22J2017-11-27T19:54:45.000ZJ124756J1472J66
‚:DEBDMVCFR_VY40J/Folge 2553: Zwischen zwei MÃ¼ttern | Rote RosenJRote Rosen OfficialJ24J2017-11-27T13:10:02.000ZJ8246J91J3
V:DEBgXlAUr2MWDYJ	NINTENDO!JsmulzieJ20J2017-11-27T01:37:40.000ZJ832247J8438J104
‚:DEBCdS9T88xwGAJ0Ø±Ø­Ù„Ø© Ø§Ù„Ù‰ Ø§Ù„ÙŠÙˆÙ†Ø§Ù† Ù…Ø¹ Ø¶ÙŠØ§Ø¡  !!JDeiaa AbdullahJ27J2017-11-26T18:26:52.000ZJ13070J1261J31
‰:DEBDr2NhIKJq1IJ0Life of KATJA: Die Couch | Gute Arbeit OriginalsJGute Arbeit OriginalsJ24J2017-11-26T09:00:00.000ZJ21397J1368J49
{:DEBfFdm3DhDdSAJ1Bleibt Holly Treu? Vorschau 28.11.17 - KÃ¶ln50667J
unnÃ¶tig21J22J2017-11-27T19:01:10.000ZJ5628J37J4
[:DEBMftc_JodXksJWitze-Mix 36JNizarComedyJ24J2017-11-26T17:00:02.000ZJ50695J2657J77
:DEBx4bOl6ufj_EJ6TÃ¶dliche Verwandtschaft - BrÃ¼der im Blutrausch - NeuJ	Mr. WhiteJ20J2017-11-27T05:45:44.000ZJ5653J46J2
Å:DEB_TixdNYZuFIJwAlena TV -Tesfit Abraha - Dgul Hiyab - Part - 5  (á‹µáŒ‰áˆ áˆ…á‹«á‰¥  áˆ“áˆáˆ»á‹­ áŠ­á‹áˆ)- New Eritrean Movie 2017JAlena TVJ24J2017-11-26T12:36:29.000ZJ205564J5226J341
Ò:DEBTcLwpKacUagJÙ…Ø´Ø§Ù‡Ø¯Ø© Ù…Ø¨Ø§Ø±Ø§Ø© Ø¨Ø±Ø´Ù„ÙˆÙ†Ø© ÙˆÙØ§Ù„Ù†Ø³ÙŠØ§ Ø¨Ø« Ù…Ø¨Ø§Ø´Ø± Ø¨ØªØ§Ø±ÙŠØ® 26-11-2017 Ø§Ù„Ø¯ÙˆØ±ÙŠ Ø§Ù„Ø§Ø³Ø¨Ø§Ù†ÙŠJMohamdAssi TvJ17J2017-11-26T22:49:17.000ZJ617879J6011J481
g:DEBGCTMkt2EzBYJS.O.S   Wie geht es weiter?JAntje SophiaJ22J2017-11-26T20:19:32.000ZJ13478J0J0
½:DEB9gRK0yQB0ocJQÎ¦ÏÏ„Î·Ï‚ Î§Î±Î»ÎºÎ¯Î´Î·Ï‚ | Î•Î»Î»Î¬Î´Î± ÎˆÏ‡ÎµÎ¹Ï‚ Î¤Î±Î»Î­Î½Ï„Î¿ | 26/11/2017J&Î•Î»Î»Î¬Î´Î± Î•Î§Î•Î™Î£ Î¤Î±Î»Î­Î½Ï„Î¿J22J2017-11-26T20:41:11.000ZJ291633J1687J302
‡:DEBg9mimFRldd4J,Marc hat die Schnauze voll ğŸ˜ |KÃ¶ln 50667JKÃ¶ln 50667 BTN Exklusiv!J22J2017-11-27T17:21:14.000ZJ28431J199J3
–:DEBlY0ckUBVerAJ@4:4 im Revier-Derby - So feierte der Schalker Anhang in DortmundJTobias WeckenbrockJ17J2017-11-25T21:06:22.000ZJ122212J642J90
u:DEB-01JK3TRtIoJ*Ã‡ocuklar DuymasÄ±n | 18.BÃ¶lÃ¼m 1.FragmanJPlayJ22J2017-11-26T20:24:41.000ZJ1044971J3351J609
w:DEBaHf3-BdeU7oJ(Das 4:4  BVB vs. SCHALKE 04 aus Block 45JMrEdelsachseJ17J2017-11-25T20:29:53.000ZJ69101J416J22
›:DEBN_rJCeZw0okJFVega & Bosca feat. Celo & Abdi, Hanybal - 20 Jahre UF (Official Audio)JfreundevonniemandJ24J2017-11-26T18:31:51.000ZJ53786J2175J59
¯:DEB4kpKsM-fpbAJbFlache Erde Live Stream Faszination - Eine Frage der Zeit  ! Flat earth research Live Stream ODDTVJFungiro InkoJ22J2017-11-28T04:18:08.000ZJ3413J93J15
‰:DEBcwAQyQUnRt4J4KrÃ¤tze wird abgeknallt?! | Berlin Tag & Nacht #1573JBerlinTagUndNachtJ22J2017-11-28T18:25:53.000ZJ46773J335J136
f:DEBfnAdOLA2oq0JÃ‡ukur 7. BÃ¶lÃ¼m sneak peekJFLANKESJ24J2017-11-27T21:26:10.000ZJ73303J377J19
˜:DEBM73qRw35gBAJJBorussia Dortmund vs. Schalke 04, 94. Minute Naldo 4:4 live im Stadion !!!Jhamude83J17J2017-11-26T10:27:15.000ZJ173500J3472J416
:DEBXMqmjxrD4YkJDChefsache Pt. 7 â€“ Die Sache mit dem Launch | Gute Arbeit OriginalsJGute Arbeit OriginalsJ24J2017-11-27T07:00:01.000ZJ33063J3015J13
:DEBmpozyTHYTMAJ7Star Wars The Clone Wars Der Aufstieg von Clovis Teil 3JStar Wars Clips DeutschJ22J2017-11-28T15:01:26.000ZJ6041J46J2
‹:DEBOgVfCIChYZQJ=Engel Orakel der Woche vom 27. November bis 03. Dezember 2017JDasEngelOrakelJ1J2017-11-28T13:56:37.000ZJ5475J153J4
˜:DEBXxgXaZzw1zQJ=Folge 2819: Freifahrtschein zum WohlfÃ¼hlen | Sturm der LiebeJSturm der Liebe OfficialJ24J2017-11-28T14:10:02.000ZJ54303J805J37
ƒ:DEBFEXGRMAj9HEJ0Folge 2554: Die Ãœberraschungsparty | Rote RosenJRote Rosen OfficialJ24J2017-11-28T13:10:02.000ZJ9138J96J5
v:DEB5zXbdpDAdKsJ&AdÄ±nÄ± Sen Koy 228. BÃ¶lÃ¼m FragmanÄ±JElvan KutmanJ1J2017-11-28T16:53:24.000ZJ211666J1136J49
–:DEBUNo_yvt3wPEJ>GHETTO GEASY feat. SKIVI - Bisha me 2 koka (Official Video 4K)JBABASTARSchannelJ24J2017-11-27T23:36:36.000ZJ614472J14319J1861
¥:DEBVuh-IKKaIV4JXBjÃ¶rn HÃ¶cke - Ã¼ber den Kampf des Parteien-Kartells gegen die AfD .. sehr sehenswert!!JHerrTeutatesJ22J2017-11-28T15:22:18.000ZJ3805J240J9
£:DEBe7-nSLOBqAYJAKim wird vor ihren Eltern versteckt!!! | Berlin Tag & Nacht #1574J Berlin Tag & Nacht - KÃ¶ln 50667J24J2017-11-28T19:05:52.000ZJ21794J124J3
:DEBOlxS5Q0m2u8J,Nursel Ergin'den Demet AkalÄ±n'a sert cevap!JSÃ¶ylemezsem OlmazJ22J2017-11-28T08:53:47.000ZJ57086J148J37
²:DEB4X-RCg7ZFq8JaSportschau Kommentator rastet beim Ausgleichstor von Naldo komplett aus I Dortmund VS Schalke 4-4JTIME 4 SPORTJ22J2017-11-26T10:44:47.000ZJ127770J860J202
Ñ:DEB6Yheq6fVUqAJ€Ù…Ù„Ø®Øµ Ù…Ø¨Ø§Ø±Ø§Ø© Ø±ÙŠØ§Ù„ Ù…Ø¯Ø±ÙŠØ¯ ÙˆÙÙˆÙŠÙ†Ù„Ø§Ø¨Ø±Ø§Ø¯Ø§ 2-2 - Ù…Ø¨Ø§Ø±Ø§Ø© Ù…Ø¬Ù†ÙˆÙ†Ø© Ø¬Ø¯Ø§ - ÙƒØ£Ø³ Ù…Ù„Ùƒ Ø§Ø³Ø¨J	Mr.AssistJ17J2017-11-28T22:12:11.000ZJ947658J8613J1326
o:DEBEseQ9w-tzkIJ%Hart aber fair - Sendung vom 27.11.17J
Freak AKidJ24J2017-11-28T15:32:21.000ZJ5252J12J7
q:DEBXuU8OGJyRK4J'Buy and Hold â€“ Teil 3 Was wÃ¤re wenn?J	Jens RabeJ27J2017-11-28T15:49:24.000ZJ3714J217J4
 :DEBjFnw9Fl7KwEJWEin lieber GruÃŸğŸƒğŸŒ¹ğŸƒfÃ¼r einen besonderen Menschen...so wie du einer bistâ£â£J
Nate ZoobeJ1J2017-11-28T07:26:02.000ZJ13171J0J0
:DEBkHTOkac84EwJ1TRAUMKARRE anschmeiÃŸen & ab nach Arizona heizen!J	FlipFloidJ22J2017-11-26T20:15:32.000ZJ47968J3507J103
l:DEBNspDjdFqAcYJ tagesschau 20:00 Uhr, 27.11.2017J
tagesschauJ25J2017-11-27T19:41:28.000ZJ9910J116J11
:DEBZ4UJPI7Z7rQJBRÃ¼cktrittsforderung Angela Merkel - Wolfgang Grieger - 25.11.2017Jmalle bargeJ25J2017-11-27T08:59:34.000ZJ6551J79J1
ƒ:DEBasVXwjEtRL4J*TOKOMI WAPI DU 28 11 2017 EYINDI NA LOMAMIJNDEKO ELIEZER TOKOKOMAJ22J2017-11-28T13:26:24.000ZJ36664J454J33
‡:DEBYUqZqcIUY7cJ5Jannes schlÃ¤gt Eule ?Berlin Tag Und Nacht Folge#1574JBerlin Tag & NachtJ22J2017-11-28T14:32:43.000ZJ3178J74J4
‰:DEBcwAQyQUnRt4J4KrÃ¤tze wird abgeknallt?! | Berlin Tag & Nacht #1573JBerlinTagUndNachtJ22J2017-11-28T18:25:53.000ZJ83909J497J736
|:DEBGu5uC1xqmVcJ-Stefanie KloÃŸ - O Holy Night - Daddys MoviesJDaddys MoviesJ10J2017-11-28T23:50:04.000ZJ24308J377J6
ˆ:DEBhrYQxO9_v1AJ:HagÃ«: I akuzuari pÃ«r krime lufte pi helm gjatÃ« seancÃ«sJRadioEvropaLireJ25J2017-11-29T13:39:01.000ZJ9920J7J1
j:DEBGlM4xt5G41IJMark Forster- Lulajze JezuniuJSven BalvinJ10J2017-11-29T15:55:42.000ZJ10171J437J4
”:DEBU47lXQZzJa8JCPogledajte kako su u Saboru reagirali kad su Äuli vijest o PraljkuJIndex.hr PortalJ25J2017-11-29T11:42:50.000ZJ92241J31J29
‡:DEBV3gzfRR--e4J?GroÃŸer Hund hilft kleinem KÃ¤tzchen/Big dog help little kittenJNickiTVJ2J2017-11-28T16:13:52.000ZJ12862J120J6
s:DEBTGKQc16lFOsJFolge 2555: Masern | Rote RosenJRote Rosen OfficialJ24J2017-11-29T13:10:02.000ZJ8268J106J2
‹:DEBJfo0ziwFH-4J=Engel Orakel der Liebe vom 29. November bis 06. Dezember 2017JDasEngelOrakelJ1J2017-11-29T07:52:07.000ZJ6339J151J4
Š:DEBsmYYhQmA6XMJ/Folge 2820: Ab in die KÃ¼che! | Sturm der LiebeJSturm der Liebe OfficialJ24J2017-11-29T14:10:02.000ZJ39671J687J21
p:DEBWp4Z2CAFIE8JFT Arsenal 5 - 0 HuddersfieldJStadium AstroJ17J2017-11-29T22:07:27.000ZJ579931J2928J128
}:DEBhPsTmJ3EqhoJ(#16 FC St. Pauli: Anlauf mit Fabian KlosJDSC Arminia BielefeldJ17J2017-11-29T12:29:41.000ZJ2339J91J1
f:DEBfnAdOLA2oq0JÃ‡ukur 7. BÃ¶lÃ¼m sneak peekJFLANKESJ24J2017-11-27T21:26:10.000ZJ95693J513J24
™:DEB6JCIS1RaucAJGJacky findet Kim und will sie umbĞ³ingen!  | | Berlin Tag & Nacht #1574JB&K HighlightJ24J2017-11-29T18:17:03.000ZJ112287J1126J48
¦:DEBKARZdFrDyvUJWSchoko Reihe 1 - einfache Schokoladen Tafeln - Mehrfarbige Tafel Schokolade - KuchenfeeJKuchenfee LisaJ22J2017-11-29T11:00:01.000ZJ4826J341J6
‘:DEBVw6qAeg1NwoJ@Ğ›Ğ˜Ğ› ĞœĞĞ Ğ¢Ğ˜ & PHARAOH - Ğ“Ğ›Ğ£Ğ¨Ğ˜Ğ¢Ğ•Ğ›Ğ¬ (prod. by LAPI)J
Morty MortJ22J2017-11-29T18:48:37.000ZJ190077J7801J1073
¤:DEBXM8Gj3bx3dQJVĞÑ‚ĞµĞ»ÑŒ Ğ­Ğ»ĞµĞ¾Ğ½ -  8 ÑĞµÑ€Ğ¸Ñ 3 ÑĞµĞ·Ğ¾Ğ½ (50 ÑĞµÑ€Ğ¸Ñ) - ĞºĞ¾Ğ¼ĞµĞ´Ğ¸Ñ HDJLegend ChannelJ1J2017-11-29T18:56:04.000ZJ13223J64J8
c:DEBTp5moL9Kb7kJZUNA ist tot?!?! /Fake NewsJjojo HDJ20J2017-11-29T20:45:12.000ZJ3279J23J35
w:DEB5zXbdpDAdKsJ&AdÄ±nÄ± Sen Koy 229. BÃ¶lÃ¼m FragmanÄ±JElvan KutmanJ1J2017-11-28T16:53:24.000ZJ470462J1752J112
É:DEB6Yheq6fVUqAJwÙ…Ù„Ø®Øµ Ù…Ø¨Ø§Ø±Ø§Ø© Ø±ÙŠØ§Ù„ Ù…Ø¯Ø±ÙŠØ¯ ÙˆÙÙˆÙŠÙ†Ù„Ø§Ø¨Ø±Ø§Ø¯Ø§ 2-2 - ØªØ£Ù„Ù‚ Ø¨ÙŠÙ„ - ÙƒØ£Ø³ Ù…Ù„Ùƒ Ø§Ø³Ø¨Ø§Ù†ÙŠØ§J	Mr.AssistJ17J2017-11-28T22:12:11.000ZJ2357074J18883J2533
l:DEBR4LncwRAuWMJ tagesschau 20:00 Uhr, 28.11.2017J
tagesschauJ25J2017-11-28T19:43:00.000ZJ9160J122J15
˜:DEBM73qRw35gBAJJBorussia Dortmund vs. Schalke 04, 94. Minute Naldo 4:4 live im Stadion !!!Jhamude83J17J2017-11-26T10:27:15.000ZJ186172J3661J433
š:DEBcgHLcQRZyFgJEDC Legends 3x08 Ending Team Flash, Arrow and Supergirl Goodbye ScenesJLegends UniverseJ24J2017-11-29T03:23:45.000ZJ135802J1076J14
^:DEBsameZ_Vu44wJaldi vs edekaJRANDOMVERBOTJ24J2017-11-28T10:28:59.000ZJ19961J2127J176
{:DEBnuAeCqQSFU0J(Folge 2556: Liebesbekundung | Rote RosenJRote Rosen OfficialJ24J2017-11-30T13:10:02.000ZJ6303J88J4
:DEBjnV1-hBagHsJ3Folge 2821: Auf den Zahn gefÃ¼hlt | Sturm der LiebeJSturm der Liebe OfficialJ24J2017-11-30T14:10:02.000ZJ38702J610J19
ˆ:DEB_KOpDF4DxEkJ6BÃ¶hse Onkelz - Auf gute Freunde (Live in Berlin 2016)JOnkelz OffiziellJ10J2017-11-30T11:59:28.000ZJ21980J637J8
˜:DEB9X0LdmQbpzEJMBUJICA 29.11.2017. GENERAL SLOBODAN PRALJAK - JUNAK! Gost: Ljubo Ä†esiÄ‡ RojsJBujica Z1TVJ22J2017-11-29T20:27:34.000ZJ46434J0J0
ˆ:DEBfenc1xIXCKEJ-Kim wird geschlagenğŸ˜‘ |Berlin Tag und NachtJKÃ¶ln 50667 BTN Exklusiv!J22J2017-11-30T18:34:23.000ZJ19224J165J6
À:DEBfUM8JaGt7k0JmĞŸÑƒÑÑ‚ÑŒ Ğ³Ğ¾Ğ²Ğ¾Ñ€ÑÑ‚: Ğ‘Ğ¾Ğ³Ğ°Ñ‚Ñ‹Ğµ Ğ¿Ğ»Ğ°Ğ½Ñ‹ Ğ’Ğ¸Ñ‚Ğ°Ğ»Ğ¸Ğ½Ñ‹ - ĞšÑ‚Ğ¾ ÑĞ»ĞµĞ´ÑƒÑÑ‰Ğ¸Ğ¹? 30.11.2017JĞ­Ñ‚Ğ¾ Ğ¤Ğ¸Ğ°ÑĞºĞ¾J22J2017-11-30T15:13:31.000ZJ77126J0J0
l:DEBGlM4xt5G41IJMark Forster- Lulajze JezuniuJSven BalvinJ10J2017-11-29T15:55:42.000ZJ35286J1110J39
‹:DEBZLqXhzneaDIJ;Jacky randaliert in der Wohnung | BTN - Vorschau 01.12.2017JB&K HighlightJ24J2017-11-30T19:23:39.000ZJ50280J333J14
:DEBqtt1NNE-mpUJ2Eine imposante Lady - die E52 mit 140 Tonnen StahlJFleischmann ModelleisenbahnenJ28J2017-11-30T06:37:48.000ZJ4566J61J0
}:DEBrKmWJ28xwQEJ(Markus Lanz vom 28. November 2017 Â© ZDFJMarkus Lanz FanclubJ24J2017-11-29T01:03:30.000ZJ26311J59J64
m:DEBJOSRWnX6Do8J)N1 Pressing: Stjepan KljuiÄ‡ (29.11.2017)JN1J25J2017-11-30T06:32:07.000ZJ24559J71J41
u:DEBKUxeVqqT-WkJ(Yemekteyiz 64. BÃ¶lÃ¼m - CanlÄ± YayÄ±nÄ±J
YemekteyizJ24J2017-11-30T14:43:18.000ZJ34843J104J29
k:DEBNvUC39GyIdsJ tagesschau 20:00 Uhr, 29.11.2017J
tagesschauJ25J2017-11-29T20:20:42.000ZJ8752J112J6
\:DEBD1ixhQkNffcJ187 Feat Boss AyseJ	Boss AyseJ23J2017-11-30T16:02:27.000ZJ1548J209J2
q:DEBvfL98dmakMYJ!IS KARZL - EPISODE 9 - SauerkrautJJÃœRGEN HUSSJ24J2017-12-01T07:15:19.000ZJ68158J925J263
u:DEB9aC-tSGoo8IJ)15. Int. ADAC Sachsen Supercross ChemnitzJChemnitzArenaJ2J2017-12-02T00:51:05.000ZJ8138J54J6
ƒ:DEBxOk9pNjrfscJ0Folge 2557: Das VersÃ¶hnungsangebot | Rote RosenJRote Rosen OfficialJ24J2017-12-01T13:10:02.000ZJ5600J89J2
:DEBLfZB28jNRZcJ8Star Wars The Clone Wars Der Aufstieg von Clovis Teil 16JStar Wars Clips DeutschJ22J2017-12-01T14:57:49.000ZJ4499J74J2
‰:DEB_KOpDF4DxEkJ6BÃ¶hse Onkelz - Auf gute Freunde (Live in Berlin 2016)JOnkelz OffiziellJ10J2017-11-30T11:59:28.000ZJ31827J790J12
‡:DEBtfkYfX4TsFQJ2GERMANY+ MITTEL-EUROPA am Abgrund+ Wer ist Merkel?JGEOENGINEERING-HAARPJ22J2017-12-01T10:51:58.000ZJ5021J376J3
:DEB2v_ENYnV-OIJ4Kim wird in Schutz genommenâ˜º |Berlin Tag und NachtJKÃ¶ln 50667 BTN Exklusiv!J22J2017-12-01T18:14:02.000ZJ4848J155J5
g:DEBF4T7OKdXLZcJ392 - shafie ayar MuhaqiqJshafie ayarJ22J2017-12-01T16:39:50.000ZJ22822J706J71
«:DEBJrAr1hoVAdIJ^Master emaAlena TV - Amanuel Tekle - Tlmi Lewahat- Part Two - New Eritrean Movie 2017 Alena TVJAlena TVJ24J2017-12-01T15:43:52.000ZJ96177J3167J109
w:DEBE2SMITuDRHEJ&ALI BUMAYE reagiert auf JBG3 DISS !!!!JDeutschrap CLANJ22J2017-11-30T21:57:10.000ZJ32326J99J73
—:DEBb15q4Q-fVr0J7Young Sheldon S01E06 - A Patch, a Modem, and a ZantacÂ®JVictoria's Secret Fashion ShowJ1J2017-12-01T05:06:42.000ZJ87766J368J25
²:DEBHAWUrlcFWvQJiUÄŸur Poyraz , Reza Zarrab'Ä±n da onu bizim baÅŸÄ±mÄ±za bela eden Tayyip ErdoÄŸan'Ä±n da canÄ± cehenneme.Jby xJ25J2017-11-30T13:56:42.000ZJ147179J757J211
h:DEBNBsZEnKehBUJArtÄ±k sana borcum yok...JEN Ä°YÄ°LER TVJ1J2017-12-01T16:12:35.000ZJ39015J162J6
l:DEBbGy3JUbCmvwJ!Kollegah und die SchornsteinfegerJDeutsch RapJ10J2017-12-01T17:39:29.000ZJ1638J56J5
:DEBxXSzaDHUUE8J=Å OK u HAAGU  Slobodan Praljak umro nakon Å¡to je popio otrovJBosnian LIVEJ22J2017-11-29T14:04:48.000ZJ283681J510J175
:DEBtUE-LGGsGU4JMDirk MÃ¼ller - Warum zurÃ¼cktreten? Es interessiert doch sowieso keinen mehr!JCashkurs.comJ25J2017-11-30T14:33:25.000ZJ34678J2084J32
v:DEBwiUfcvqI5EgJ&AdÄ±nÄ± Sen Koy 231. BÃ¶lÃ¼m FragmanÄ±JElvan KutmanJ1J2017-12-01T16:50:00.000ZJ218813J1315J53
’:DEBhThA6FVEWhQJCAndrÃ©s SeitensprÃ¼nge sind alle aufgeflogen | Berlin - Tag & NachtJB&K HighlightJ24J2017-12-01T18:22:13.000ZJ18131J124J5
j:DEB0gje3-1uhoIJ tagesschau 20:00 Uhr, 01.12.2017J
tagesschauJ25J2017-12-01T19:45:58.000ZJ3493J49J5
y:DEB3HREXtGCtqEJ+The big bang theory S11 E09: Missing LaptopJDanish KhanJ24J2017-12-01T08:37:03.000ZJ51131J177J15
s:DEBvfL98dmakMYJ!IS KARZL - EPISODE 9 - SauerkrautJJÃœRGEN HUSSJ24J2017-12-01T07:15:19.000ZJ143700J1498J679
z:DEBxziYfKLIilUJ)BeÅŸiktaÅŸ 3-0 Galatasaray MaÃ§ Ã–zeti HDJBK SPORTS HDJ17J2017-12-02T18:39:59.000ZJ216281J734J543
’:DEBoaUP7jDvTycJ8New Eritrean film dama part 16 Shalom Entertainment 2017JShalom EntertainmentJ22J2017-12-02T17:33:52.000ZJ153090J3676J171
¥:DEBf6Pr4j3fLl0JQJimmy Kimmel monologue - 12/1/17 : Kimmel Explain The Flynn/Trump/Mueller DynamicJFull InterviewJ22J2017-12-02T06:18:10.000ZJ396320J1924J331
‚:DEBJBLFiPs7SMsJ4BeÅŸiktaÅŸ 3-0 Galatasaray MaÃ§ Ã–zeti  (02.12.2017)JÃ–ZET TVJ17J2017-12-02T18:40:04.000ZJ263202J1226J251
¤:DEBrm9BFh_jaRUJZMerry Christmas Songs 2018 - Top Christmas Songs Playlist 2018 - Best Christmas Songs EverJ	EDM MediaJ24J2017-12-02T10:42:57.000ZJ173592J0J0
:DEBD6hWxx0k4CkJ2PietSmiet malt: Die schlechtesten Zeichnungen everJ	PietSmietJ24J2017-12-02T17:05:00.000ZJ57385J2905J63
²:DEB4_430wAV82QJbThe Graham Norton Show S22E09: Sir Elton John, Carey Mulligan, Stephen Fry, Robbie Williams & PinkJLaura awkwardJ10J2017-12-02T03:41:52.000ZJ59968J431J17
Œ:DEBudZqD4ZqDaoJBArminia Bielefeld vs St.Pauli 5-0 All Goals & Highlights 1/12/2017J
ESM SPORTSJ22J2017-12-02T14:26:19.000ZJ2843J20J4
}:DEB5969At0t7NcJ/Rita Ora sings at The Voice Of Germany LIVE HD1JLife NatureJ24J2017-12-01T19:52:03.000ZJ16225J181J19
‡:DEBtFr8Zg1cFOoJ8CanBroke | Controller kaputt wegen FIFA 18 | Broke2L1 #4JCanBrokeJ24J2017-12-02T09:00:02.000ZJ122133J16366J393
¥:DEBkCatPwK42EIJ?Die Sendung mit dem HÃ¶cke: Opfer und Ãœberwachungsgeschichten!J"Zentrum fÃ¼r Politische SchÃ¶nheitJ25J2017-12-01T07:34:09.000ZJ20219J517J139
|:DEB6okiblZcnf8J1TEILEN: Angela Merkel Zitate immer geisteskrankerJ
Svens WeltJ25J2017-12-02T19:16:25.000ZJ4036J404J3
˜:DEBF4tSA2wjIlwJNĞ‘Ğ¸Ñ‚Ğ²Ğ° ÑĞºÑÑ‚Ñ€Ğ°ÑĞµĞ½ÑĞ¾Ğ², 18 ÑĞµĞ·Ğ¾Ğ½, 11 ÑĞµÑ€Ğ¸Ñ (02.12.2017)JNEWSJ22J2017-12-02T16:16:54.000ZJ264569J1331J447
:DEBtUE-LGGsGU4JMDirk MÃ¼ller - Warum zurÃ¼cktreten? Es interessiert doch sowieso keinen mehr!JCashkurs.comJ25J2017-11-30T14:33:25.000ZJ45761J2360J39
x:DEBE2SMITuDRHEJ&ALI BUMAYE reagiert auf JBG3 DISS !!!!JDeutschrap CLANJ22J2017-11-30T21:57:10.000ZJ40236J120J94
š:DEB7HbVxpBE7jwJKSchoko Reihe 3 - KaffÃ©e Pralinen - HerzfÃ¶rmige CafÃ© Pralinen - KuchenfeeJKuchenfee LisaJ22J2017-12-02T12:40:35.000ZJ4032J279J5
ˆ:DEBtfkYfX4TsFQJ2GERMANY+ MITTEL-EUROPA am Abgrund+ Wer ist Merkel?JGEOENGINEERING-HAARPJ22J2017-12-01T10:51:58.000ZJ11101J573J6
j:DEBKsa-dVaeal0J tagesschau 20:00 Uhr, 02.12.2017J
tagesschauJ25J2017-12-02T19:44:07.000ZJ3658J51J8
˜:DEBtJELPsUhiQ8JCStephen Colbert monologue 12/1/17 : Coffee Joe Calls Trump Cuckoo !JFederica BalsamoJ17J2017-12-02T05:08:04.000ZJ194896J948J141
:DEBSokAghZXjT0J+Berlin Tag & Nacht - Vorschau vom 1.12.2017J Berlin Tag & Nacht - KÃ¶ln 50667J22J2017-12-02T08:10:32.000ZJ101790J751J33
‡:DEB3HSW49lptVYJ8Weihnachtenâ€¦ ohne mich, mein Schatz! KomÃ¶die, DE 2012JInga LindstrÃ¶mJ22J2017-12-02T10:22:07.000ZJ6391J22J6
¬:DEBJrAr1hoVAdIJ^Master emaAlena TV - Amanuel Tekle - Tlmi Lewahat- Part Two - New Eritrean Movie 2017 Alena TVJAlena TVJ24J2017-12-01T15:43:52.000ZJ130739J3677J127
z:DEBVkXpKItU89UJ-TIME LIES prÃ¤sentiert: Kuscheldolf (Preview)J	SnicklinkJ24J2017-12-02T13:38:04.000ZJ24636J1992J41
¡:DEB4mF87jJ-qAMJVBUJICA 01.12.2017. ANTE PRKAÄŒIN O GENERALU PRALJKU, STIPI MESIÄ†U I HAAÅ KOJ PRESUDI!JBujica Z1TVJ22J2017-12-01T22:02:20.000ZJ46574J0J0
s:DEBvfL98dmakMYJ!IS KARZL - EPISODE 9 - SauerkrautJJÃœRGEN HUSSJ24J2017-12-01T07:15:19.000ZJ182107J1713J765
t:DEBGcbsIv3QdFsJ It's Here!!! CASEY NEISTAT MERCHJCaseyNeistatJ22J2017-12-03T16:40:05.000ZJ854323J44130J3342
w:DEBdiBVNqAwqHwJ-Dynamo Dresden vs Aue 4-0 All Goals 3/12/2017J
ESM SPORTSJ22J2017-12-03T14:44:42.000ZJ5860J31J1
:DEBPrg2FamGfjgJ?Wenn Du ein Problem nicht lÃ¶sen kannst, lÃ¶se Dich vom ProblemJSilke SchaeferJ27J2017-12-03T13:48:13.000ZJ11334J340J7
:DEBUxC_vGFSOLEJ0Sturm der Liebe Vorschau fÃ¼r Folge 2824  - 2829Jsturmderliebe99J24J2017-12-03T16:08:17.000ZJ9017J51J6
’:DEBoaUP7jDvTycJ8New Eritrean film dama part 16 Shalom Entertainment 2017JShalom EntertainmentJ22J2017-12-02T17:33:52.000ZJ237024J4699J251
“:DEBqBem8DO4jssJG03.12.2107 die letzte Uffta vom Capo Lehmi! Dynamo gegen Wismut Aue 4:0J	myDresdenJ17J2017-12-03T15:15:49.000ZJ20184J316J18
‡:DEBtFr8Zg1cFOoJ8CanBroke | Controller kaputt wegen FIFA 18 | Broke2L1 #4JCanBrokeJ24J2017-12-02T09:00:02.000ZJ159633J19245J488
‚:DEBBosziPS2BuYJ4Engel Orakel der Woche vom 04. bis 10. Dezember 2017JDasEngelOrakelJ1J2017-12-03T10:21:37.000ZJ5308J170J4
n:DEBg89jmIOqiYsJ Zum letzten Mal Uffta mit Lehmi!JDynamo FanblogJ22J2017-12-03T15:26:53.000ZJ5202J55J0
¬:DEBF4O46vyeMH4J^Alena TV - New Eritrean Comedy 2017 - Alexander Amanuel -Mekeret Part -  Five -  Eritean MovieJAlena TVJ24J2017-12-03T14:16:52.000ZJ108659J2999J320
l:DEBMe4jqDEaw6kJ!Presseclub - Sendung vom 03.12.17J
Freak AKidJ24J2017-12-03T11:54:31.000ZJ6484J10J17
‡:DEBj4Wuz-3ZxjQJ8Richard David Precht | Angst vor dem Fremden? 03.12.2017JKosake van ZeJ22J2017-12-03T08:54:05.000ZJ8177J166J25
}:DEB5969At0t7NcJ/Rita Ora sings at The Voice Of Germany LIVE HD1JLife NatureJ24J2017-12-01T19:52:03.000ZJ40677J390J36
¥:DEBf6Pr4j3fLl0JQJimmy Kimmel monologue - 12/1/17 : Kimmel Explain The Flynn/Trump/Mueller DynamicJFull InterviewJ22J2017-12-02T06:18:10.000ZJ500008J2233J433
¤:DEBrm9BFh_jaRUJZMerry Christmas Songs 2018 - Top Christmas Songs Playlist 2018 - Best Christmas Songs EverJ	EDM MediaJ24J2017-12-02T10:42:57.000ZJ215664J0J0
µ:DEBHJs0TMCWFVMJcRacing StraÃŸburg - Paris Saint-Germain 2:1 / PSG mit der ersten Saison-Pleite gegen den AufsteigerJBILD FUSSBALLJ17J2017-12-02T20:49:45.000ZJ205926J5458J84
¨:DEBg03CGsgkY3oJPLiebesorakel fÃ¼r Dualseelen , Wunschpartner und (Ex) - Partner, - Der HerzblickJLuna Maries SeelenblickJ22J2017-12-03T12:09:13.000ZJ3187J101J6
 :DEBj6_ujPh-G_gJRBjoÌˆrn HoÌˆcke zieht ein positives Fazit nach dem AfD Bundesparteitag in HannoverJHerrTeutatesJ22J2017-12-04T07:23:31.000ZJ7893J385J12
œ:DEBE-IuTRNkxroJNØ¨Ø±Ù†Ø§Ù…Ø¬ Take Me Out Ù†Ù‚Ø´Øª - Ø§Ù„Ù…ÙˆØ³Ù… 2 - Ø§Ù„Ø­Ù„Ù‚Ø© 4 ÙƒØ§Ù…Ù„Ø©JDiwan HDJ22J2017-12-03T22:11:41.000ZJ205493J1329J186
…:DEBQwbn7m1RZucJ2Folge 2558: Mangelnde Glaubhaftigkeit | Rote RosenJRote Rosen OfficialJ24J2017-12-04T13:10:03.000ZJ5594J79J2
:DEBPrg2FamGfjgJ?Wenn Du ein Problem nicht lÃ¶sen kannst, lÃ¶se Dich vom ProblemJSilke SchaeferJ27J2017-12-03T13:48:13.000ZJ27020J569J36
}:DEB-8p9kNRuEfgJ(Seren Serengil'den ÅŸok ayrÄ±lÄ±k haberiJSÃ¶ylemezsem OlmazJ22J2017-12-04T09:40:16.000ZJ84912J219J55
u:DEBGcbsIv3QdFsJ It's Here!!! CASEY NEISTAT MERCHJCaseyNeistatJ22J2017-12-03T16:40:05.000ZJ1097055J51250J4306
’:DEBeP9dJKLUBHMJ7Folge 2823: Einladung zum Sushi-Essen | Sturm der LiebeJSturm der Liebe OfficialJ24J2017-12-04T14:10:01.000ZJ38588J646J24
™:DEBeTkjmkfM38MJHSome Removal Blackheads On The Face Easy | How To Remove Blackheads EasyJBeautytipcneJ22J2017-12-04T17:07:38.000ZJ150595J736J146
 :DEBQR1U24tWJBIJHTriff Florentin und Katja - das GAO Meet & Greet | Gute Arbeit OriginalsJGute Arbeit OriginalsJ24J2017-12-03T09:00:02.000ZJ23260J2048J9
s:DEBvfL98dmakMYJ!IS KARZL - EPISODE 9 - SauerkrautJJÃœRGEN HUSSJ24J2017-12-01T07:15:19.000ZJ194377J1778J781
:DEB8uLtJbz8oUcJ+Jacky muss weg?! | Berlin Tag & Nacht #1577JBerlinTagUndNachtJ22J2017-12-04T18:11:36.000ZJ49762J538J12
 :DEBQ_CFaU14RR4JWMerry Christmas 2018 - Top Christmas Songs Playlist 2018 - Best Songs Of Christmas 2018J	EDM MediaJ24J2017-12-04T12:00:59.000ZJ60989J0J0
³:DEBDyLEKmBem5sJKØ´Ø§Ù‡Ø¯ ØªÙØ§ØµÙŠÙ„ Ù…Ù‚ØªÙ„ Ø§Ù„Ø²Ø¹ÙŠÙ… Ø¹Ù„ÙŠ Ø¹Ø¨Ø¯ Ø§Ù„Ù„Ù‡ ØµØ§Ù„Ø­J"Ø´Ø¤ÙˆÙ† Affairs ÙŠÙ…Ù†ÙŠØ© YemeniJ25J2017-12-04T14:50:27.000ZJ775811J1718J752
t:DEB8Ddnj03Ub5IJ%Siyah Ä°nci 11. BÃ¶lÃ¼m 2. TanÄ±tÄ±m!J
STARTVSTARJ24J2017-12-04T20:17:28.000ZJ169818J1222J49
q:DEBNopqDEHI-RcJ)NajwaÅ¼niejsze wydarzenia dnia 04.12.2017JSerwisJ22J2017-12-04T15:05:00.000ZJ12604J138J6
[:DEBB-Tri4OrX1IJWitze-Mix 37JNizarComedyJ24J2017-12-03T17:00:02.000ZJ35679J2066J52
z:DEB7JbSH10IHr8J'TOBINATOR WEIHNACHTSVERLOSUNG 2017 ğŸ„JTobinatorLetsPlayJ20J2017-12-04T20:33:45.000ZJ8046J1354J4
›:DEBwLAnQQumC24JMNew Eritrean comedy 2017 - Beal Mekina - by ermile | á‹“áˆ­áŠ¨ áˆ˜á‹˜áŠ“ 2017JDehay hafasJ10J2017-12-03T16:47:06.000ZJ46684J559J35
 :DEBq0kjF_MF1mEJOXXL Ballon Popping Slime Selber MachenğŸˆğŸ˜‚ Mega Sauerei! ||LeonieKawai XoxoJLeonieKawai XoxoJ2J2017-12-04T17:58:25.000ZJ3956J274J15
ˆ:DEBy6AN6Ijzox0J<Bayern Munchen vs PSG 3-1 - All Goals & Highlights 5/12/2017JIuonakJ17J2017-12-05T21:08:13.000ZJ446737J1271J947
¨:DEBj2Ho01bNJ4YJVBayern de Munique 3 x 1 PSG - Melhores Momentos e Gols - Liga dos CampeÃµes 05-12-2017JBDV FootballJ17J2017-12-05T21:38:58.000ZJ462096J4835J270
…:DEBTOgfYHENy3IJ3Folge 2559: Das BackanfÃ¤nger-Tutorial | Rote RosenJRote Rosen OfficialJ2J2017-12-05T13:10:01.000ZJ5651J78J4
t:DEBPuMtqfK3FLAJ&Hayat SÄ±rlarÄ± 6. BÃ¶lÃ¼m 2. Fragman!J
STARTVSTARJ24J2017-12-05T07:47:49.000ZJ115510J731J21
ƒ:DEBtvg2q9tkjdUJ+Verschiedene NationalitÃ¤ten beim aufwachenJAchi der EntertainerJ23J2017-12-05T19:40:11.000ZJ31879J2699J85
‡:DEB1eoNhBelurUJ'Studiobesuch sorgt fÃ¼r Stress VORSCHAUJ Btn und KÃ¶ln Videos Alte FolgenJ22J2017-12-05T19:41:26.000ZJ5570J34J0
f:DEBVIVgO-d6IswJAdÄ±nÄ± Sen Koy Yeni FragmanJMis GibiJ22J2017-12-05T15:57:22.000ZJ35900J194J8
t:DEBmBaqFp258koJ(Marko Bosnjak - Da je tuga snijeg (Live)JAL MusicJ24J2017-12-05T16:58:29.000ZJ78219J3383J38
—:DEBQpf3VanSpA4JFDie Wahrheit Ã¼ber Franco A. | Der Tod des AfD-Stadtrates Oliver NoackJOliver JanichJ25J2017-12-04T12:41:49.000ZJ30002J850J100
Œ:DEBvMq8k2xR7r0J1Folge 2824: Traum vom Triathlon | Sturm der LiebeJSturm der Liebe OfficialJ24J2017-12-05T14:10:02.000ZJ38072J713J31
ƒ:DEB4muU9001OmQJ:Soy Luna 2 - JazmÃ­n bekommt Lob fÃ¼r ihr Video (Folge 72)J	PlaybrushJ1J2017-12-05T20:40:45.000ZJ3462J125J1
„:DEBJmm5yE95534J0Bircan Ä°pek: Murat Boz, GÃ¶khan'Ä± kÄ±skanÄ±yorJSÃ¶ylemezsem OlmazJ22J2017-12-05T09:48:48.000ZJ21715J63J27
k:DEBcsnFdpjEenUJ!Short in Bitcoin â€“ BloÃŸ nicht!J	Jens RabeJ27J2017-12-05T15:00:03.000ZJ2881J180J5
l:DEBQCEkLYxoJyoJ tagesschau 20:00 Uhr, 04.12.2017J
tagesschauJ25J2017-12-04T20:10:42.000ZJ8957J103J14
[:DEBB-Tri4OrX1IJWitze-Mix 37JNizarComedyJ24J2017-12-03T17:00:02.000ZJ46883J2341J62
^:DEBFHJkna1gTC8JZehra nerdesin?JEN Ä°YÄ°LER TVJ1J2017-12-05T16:54:41.000ZJ34189J221J3
„:DEBtvg2q9tkjdUJ+Verschiedene NationalitÃ¤ten beim aufwachenJAchi der EntertainerJ23J2017-12-05T19:40:11.000ZJ55067J3782J208
m:DEBN2kCFZeniOYJ tagesschau 20:00 Uhr, 05.12.2017J
tagesschauJ25J2017-12-05T19:44:16.000ZJ10287J121J27
~:DEBx2PGj7Ly8KMJ/Engel Monatsorakel der Liebe fÃ¼r Dezember 2017JDasEngelOrakelJ1J2017-12-06T13:36:33.000ZJ7145J207J11
Œ:DEB2kO2YD36Sz8J1Folge 2825: Entspannter Ausflug | Sturm der LiebeJSturm der Liebe OfficialJ24J2017-12-06T14:10:02.000ZJ38013J612J13
…:DEBTOgfYHENy3IJ3Folge 2559: Das BackanfÃ¤nger-Tutorial | Rote RosenJRote Rosen OfficialJ2J2017-12-05T13:10:01.000ZJ9031J87J6
¡:DEBPWFfuz0kU74JKErdoÄŸan Sonunda PatladÄ±; KudÃ¼s KÄ±rmÄ±zÄ± Ã‡izgimizdir. Ordu KudÃ¼s'e...JEVLAD-I FATÄ°HANJ25J2017-12-05T14:52:51.000ZJ166916J4787J275
v:DEBxBc3JuDvSbAJ.Berlin Tag und Nacht - VORSCHAU fÃ¼r 7.12.2017JInaa 144J22J2017-12-06T19:05:37.000ZJ2114J14J0
«:DEBFrksukQYuBUJ\Daniele Ganser Ã¼ber die JFK-files, die Energieversorgung und illegale Kriege | Cashkurs.comJCashkurs.comJ25J2017-12-05T15:00:02.000ZJ26559J829J31
«:DEB6o3rCzF0j4wJOSoy Luna 2 - Clip: Luna spricht das Thema Cancun bei ihren Eltern an (Folge 72)JVidNer123/Soy Luna 2 - ClipsJ22J2017-12-06T00:55:04.000ZJ4203J97J0
u:DEBmBaqFp258koJ(Marko Bosnjak - Da je tuga snijeg (Live)JAL MusicJ24J2017-12-05T16:58:29.000ZJ229196J8238J84
s:DEBsaTBXHWMsQwJ'Coach's Corner vom 05.12.2017 (deustch)JMarcinator_2J17J2017-12-06T05:22:23.000ZJ4882J69J2
‹:DEBDvD3kHJYa-MJ7Stephen Colbert monologue 12/5/17 : A Whole Lotta MooreJFederica BalsamoJ17J2017-12-06T05:57:18.000ZJ177236J801J49
Œ:DEBeriB4YGLk3YJ@Keine Gnade fÃ¼r Andre | Szene vom 07.12.17 | Berlin Tag & NachtJIbo MarocinoJ24J2017-12-06T19:31:12.000ZJ1969J17J0
s:DEBqgp1McPZQokJ!Folge 2028: Ungeahnte DimensionenJDahoam is DahoamJ24J2017-12-07T18:56:28.000ZJ11256J146J6
p:DEBtAMyA4hbeBoJ&Azet - Gjynah (Official Audio) + LyricJdilanJ22J2017-12-07T23:12:51.000ZJ36770J3182J126
§:DEBfEJtb_ZVT1EJXEs ist immer zu spÃ¤t.  In dieser Nacht..wirst du mich dreimal verleugnen. OffenbarungenJAntje SophiaJ22J2017-12-07T15:50:42.000ZJ13826J462J47
:DEB5YbtQhmDLTcJ5Folge 2826: VerdÃ¤chtiges Verhalten | Sturm der LiebeJSturm der Liebe OfficialJ24J2017-12-07T14:10:01.000ZJ44045J659J27
€:DEBpcUnfbynYqQJ-Folge 2561: Der Krankentransport | Rote RosenJRote Rosen OfficialJ24J2017-12-07T13:10:02.000ZJ6355J93J8
‚:DEBqu9pyWOVA0QJ:8. DezemberğŸ„Adventskalenderâ›„Liebe GrÃ¼ÃŸe von mirğŸ’•J
Nate ZoobeJ1J2017-12-08T04:40:32.000ZJ3768J0J0
c:DEBVZ_I4itIBJYJAndrea Nahles: BÃ¤tschi!JMartin HagenJ25J2017-12-07T19:09:15.000ZJ2448J4J3
ˆ:DEBjS45JDYCtwoJ6Mandy ist halt anderes Berlin Tag Und Nacht Folge#1581JBerlin Tag & NachtJ22J2017-12-07T18:27:28.000ZJ3808J77J1
Z:DEByGthHOPt3IwJKurzes Statusupdate!JyeeehJ22J2017-12-08T02:00:50.000ZJ3939J738J3
›:DEB3LHRsExxB-QJ?Soy Luna 2 - Clip: Vorschau auf Folge 75 (aus Folge 74) [1080p]JVidNer123/Soy Luna 2 - ClipsJ22J2017-12-07T19:00:04.000ZJ3845J95J1
ƒ:DEBYnsMds-I97kJ:Soy Luna 2 - Simon zerreiÃŸt die Karten von Yam (Folge 74)J
Soy LunitaJ1J2017-12-07T20:11:19.000ZJ3596J86J1
:DEBZK_3ayloXDYJHâ€Unser (T)Raumschiff - Bildungâ€œ -  bullyparade - TV Comedyshow/ 1999JMichael Bully HerbigJ24J2017-12-07T14:30:00.000ZJ4348J385J1
m:DEB-zPUrIM0NHoJ#Steel Buddies - Michaels LebenslaufJ
TinylimbimJ24J2017-12-07T19:13:42.000ZJ2642J40J0
:DEBZ8N4SxMBjLYJ(DiriliÅŸ ErtuÄŸrul 99.BÃ¶lÃ¼m FragmanÄ±?JDiriliÅŸ TelevizyonJ1J2017-12-07T13:00:45.000ZJ301430J553J223
–:DEB4Vd-pdfGOOcJKSoy Luna 2 - Ãmbar fliegt aus dem Team und bekommt eine Anzeige (Folge 73)J	PlaybrushJ1J2017-12-06T20:57:38.000ZJ31658J534J20
Š:DEB0TvbGhiVSKgJ6Basti schenkt Mandy was ;)) | Berlin Tag & Nacht #1579JBerlinTagUndNachtJ22J2017-12-07T18:08:58.000ZJ47481J588J17
„:DEBtvg2q9tkjdUJ+Verschiedene NationalitÃ¤ten beim aufwachenJAchi der EntertainerJ23J2017-12-05T19:40:11.000ZJ69246J4348J237
:DEBJe5roEm4knAJ>Hat Agent Q Trumps Geheimplan verraten? Wurde er abgeschaltet?JOliver JanichJ25J2017-12-07T11:56:11.000ZJ21889J870J67
:DEBJe5roEm4knAJ>Hat Agent Q Trumps Geheimplan verraten? Wurde er abgeschaltet?JOliver JanichJ25J2017-12-07T11:56:11.000ZJ33772J1057J115
y:DEBvOfn3USm--4J-Das Aus von Alex & Mel!!! | KÃ¶ln 50667 #1582JIbo MarocinoJ24J2017-12-08T19:05:31.000ZJ6890J34J2
 :DEBj_rkl5egtawJMDie Begegnungen | Harry Potter Fanfiktion | Hermine & Draco | #30 [Staffel 2]JReadingBookChannelJ24J2017-12-08T15:00:03.000ZJ7299J759J5
:DEBpSSBKDRbrzIJNSheldon is telling everybody about meemaw's secret recipe-Young Sheldon S01E07JSheikh MusaJ22J2017-12-08T16:03:18.000ZJ107840J688J11
n:DEBYI00GNLGVecJ&KÃ¶ln 50667 - Vorschau fÃ¼r 11.12.2017JInaa 144J22J2017-12-08T18:04:31.000ZJ2013J11J0
¨:DEBfEJtb_ZVT1EJXEs ist immer zu spÃ¤t.  In dieser Nacht..wirst du mich dreimal verleugnen. OffenbarungenJAntje SophiaJ22J2017-12-07T15:50:42.000ZJ23507J587J127
Å:DEBjuKIJsRW_hAJHDIY: hÃ¼bsche Weihnachtskarten fÃ¼r LED-Teelichter [How to] Deko KitchenJ;Deko Kitchen â€“ SchÃ¶ne Deko selber machen | Esther StraubJ26J2017-12-08T11:33:38.000ZJ8558J468J10
†:DEBGt1iJQEAUwsJ$KÃ¶ln 50667 - Vorschau vom 8.12.2017J Berlin Tag & Nacht - KÃ¶ln 50667J22J2017-12-08T18:54:33.000ZJ12081J120J5
–:DEBjA2gEXMqn58JDBÃ¶hse Onkelz - Memento - Gegen die Zeit + Live in Berlin - Teaser 2JOnkelz OffiziellJ10J2017-12-08T10:02:06.000ZJ19120J391J5
[:DEBC9bH1y4ybXsJ
Drift AudiJPhilippe BlattnerJ23J2017-12-08T14:36:00.000ZJ1435J11J4
—:DEBBQ8xVP838tEJ>Anna Heimrath - Fix You | Sing Off | The Voice Of Germany 2017JThe Voice of Germany 2017J22J2017-12-08T16:06:46.000ZJ3804J76J4
l:DEBiWFgvbf_Zu8JFromSoftware's new projectJFROMSOFTWAREJ20J2017-12-08T02:00:25.000ZJ566874J8176J182
h:DEBPSv32lAFIbsJRewinside Intro VorschlagğŸ˜‚J	erenbosssJ20J2017-12-08T18:47:20.000ZJ1580J192J37
—:DEBZpbFXT9Ai4oJ3AdÄ±nÄ± Sen Koy 236-237.bÃ¶lÃ¼m fragmanğŸ˜²ğŸ˜²ğŸ˜²J ADINI SEN KOY ASK_ZEHOM_AÄ°LESÄ°J22J2017-12-08T15:52:09.000ZJ122218J671J29
]:DEByGthHOPt3IwJKurzes Statusupdate!JyeeehJ22J2017-12-08T02:00:50.000ZJ12342J2188J13
:DEBOBak5PUuhHoJTJak zagraniczne media komentujÄ… rezygnacjÄ™ Beaty SzydÅ‚o ze stanowiska premiera RPJSerwisJ22J2017-12-08T08:59:08.000ZJ23149J206J26
l:DEBN-k0EgdhJ-cJ4 Bilder 1 YouTuberJConCrafter | LUCAJ24J2017-12-09T13:00:03.000ZJ359031J34019J1249
~:DEB134QqCq3X-YJ/Rita Ora sings at The Voice Of Germany LIVE HD1JLife NatureJ22J2017-12-08T18:37:08.000ZJ40587J684J100
“:DEBtwDtHluMNKgJDCanBroke | RB Leipzig - Besiktas 1:2 | Live Reaktion aus dem StadionJCanBrokeJ24J2017-12-09T09:00:04.000ZJ212444J21260J761
œ:DEBIPJQtb2RyisJBNew Eritrean film Dama (á‹³áˆ›) part 17  Shalom Entertainment 2017JShalom EntertainmentJ22J2017-12-09T08:26:50.000ZJ205470J4720J263
Ë:DEBGo0CH4tAdswJuThe Voice Kids Ø§Ø³Ø£Ù„ Ù…Ø±Ù‡ Ø¹Ù„ÙŠÙ†Ø§ - Ø®Ø§Ù„Ø¯ Ø§Ù„Ù…Ø±Ø¹ÙŠ Ø°Ø§ ÙÙˆÙŠØ³ ÙƒÙŠØ¯Ø² Ù…Ø±Ø­Ù„Ø© Ø§Ù„ØµÙˆØª ÙˆØ¨Ø³JØµØ¯Ù‰ Ø§Ù„Ù†Ø¬ÙˆÙ…J24J2017-12-09T21:24:33.000ZJ34544J252J30
f:DEBVkUjhNXFheMJSteel Buddies - Kaffee & Ã–lJ
TinylimbimJ24J2017-12-09T16:24:55.000ZJ5590J42J2
—:DEBjA2gEXMqn58JDBÃ¶hse Onkelz - Memento - Gegen die Zeit + Live in Berlin - Teaser 2JOnkelz OffiziellJ10J2017-12-08T10:02:06.000ZJ26336J469J10
l:DEBN-k0EgdhJ-cJ4 Bilder 1 YouTuberJConCrafter | LUCAJ24J2017-12-09T13:00:03.000ZJ518832J42391J2115
m:DEBqSVlpSd8YH0Jand I love it more every momentJ
fabilein93J15J2017-12-10T12:34:30.000ZJ24162J2466J15
Ô:DEB_IOuzPIdI3oJ}Ø¨Ø±Ù†Ø§Ù…Ø¬ Ø°Ø§ ÙÙˆÙŠØ³ ÙƒÙŠØ¯Ø² Ø§Ù„Ù…ÙˆØ³Ù… Ø§Ù„Ø«Ø§Ù†Ù‰ Ø§Ù„Ø­Ù„Ù‚Ø© Ø§Ù„Ø«Ø§Ù†ÙŠØ© 2018 The Voice Kids Season 2 Ep2 HDJOFFICIALYSMVIDEOSJ10J2017-12-09T22:46:11.000ZJ660442J7660J779
|:DEBdu_rb1hzfYkJ'FT Manchester Utd 1 - 2 Manchester CityJStadium AstroJ17J2017-12-10T20:06:43.000ZJ2467562J10330J969
t:DEB3ELBCcJe9bwJ)FINALA iUmor se transmite LIVE pe YoutubeJiUmorJ23J2017-12-10T19:22:51.000ZJ164158J4388J303
“:DEBtwDtHluMNKgJDCanBroke | RB Leipzig - Besiktas 1:2 | Live Reaktion aus dem StadionJCanBrokeJ24J2017-12-09T09:00:04.000ZJ244478J23113J931
h:DEBMej6I6AWOhkJI fixed YouTube RewindJ
jacksfilmsJ23J2017-12-10T20:32:02.000ZJ831311J89799J1889
:DEB134QqCq3X-YJ/Rita Ora sings at The Voice Of Germany LIVE HD1JLife NatureJ22J2017-12-08T18:37:08.000ZJ99237J1571J215
l:DEBTCRldLHtaRIJMein Comic-Bruder Luke s1e1JFilme And SerienJ22J2017-12-10T17:06:50.000ZJ6631J107J5
]:DEBgBNCZVRpTTYJKohle - 99/17JWitz vom OlliJ24J2017-12-10T07:22:26.000ZJ30270J397J69
Î:DEBLyPBbdQAQXMJwThe Voice Kids Ø±Ø²Ù‚ Ø§Ù„Ù„Ù‡ Ø¹Ø§Ù„Ø¹Ø±Ø¨ÙŠØ§Øª - ØªØ§Ø¬ Ù‚Ø³Ø§Ù… Ø°Ø§ ÙÙˆÙŠØ³ ÙƒÙŠØ¯Ø² Ù…Ø±Ø­Ù„Ø© Ø§Ù„ØµÙˆØª ÙˆØ¨Ø³JØµØ¯Ù‰ Ø§Ù„Ù†Ø¬ÙˆÙ…J24J2017-12-09T20:27:41.000ZJ100722J684J45
o:DEBofZJ4GmK4YQJ"Helene Fischer Show 17 Tina/HeleneJbonita heleneJ22J2017-12-10T15:13:15.000ZJ5193J42J2
‚:DEBrlcTff0QdLYJ4Engel Orakel der Woche vom 11. bis 17. Dezember 2017JDasEngelOrakelJ1J2017-12-10T05:15:36.000ZJ8092J227J3
œ:DEBIPJQtb2RyisJBNew Eritrean film Dama (á‹³áˆ›) part 17  Shalom Entertainment 2017JShalom EntertainmentJ22J2017-12-09T08:26:50.000ZJ253825J5200J325
 :DEBKLT6MwxhBFoJGMANCHESTER UNITED 1 VS 2 MANCHESTER CITY FULL HIGHLIGHT & GOAL  2017/18JSPS Proudly PresentJ22J2017-12-10T20:47:24.000ZJ597378J2169J215
“:DEBjH4wOJKf1n8J;Herz und Kopf - Liebesorakel fÃ¼r Wunschpartner/ DualseelenJLuna Maries SeelenblickJ22J2017-12-10T10:43:15.000ZJ4286J98J12
[:DEBV0l1NkhEZb4JWitze-Mix 38JNizarComedyJ24J2017-12-10T17:00:02.000ZJ33734J1994J46
›:DEBrurOeON7O7kJMKÃ¶ln 3 - 4 Freiburg - CHRISTIAN STREICH - Beitrag Match Interview 10-12-2017JMySportLiveTVJ17J2017-12-10T15:49:32.000ZJ13515J44J5
À:DEBdzFhx-6jTg0JxEritrean shingrwa áˆ½áŠ•áŒáˆ­á‹‹ part 2 -2017 part 2 áŠ«á‰¥ áˆ˜áŠ•á‹°áˆáˆ« /// Eritrean shingrwa part 2 from mendeferaJDehayJ24J2017-12-09T11:57:58.000ZJ68809J757J82
o:DEBux3axAwJQQ4J PLAKU NAZMI NEZIRI    09 12 2017JPortali RTV 21J25J2017-12-09T17:05:27.000ZJ31022J16J0
l:DEBN-k0EgdhJ-cJ4 Bilder 1 YouTuberJConCrafter | LUCAJ24J2017-12-09T13:00:03.000ZJ591232J46612J2416
o:DEB8UO4l-64LSkJ#Abonniert Gronkh, deabonniert Bibi!JiKuchenJ23J2017-12-10T17:00:01.000ZJ34754J2459J138
m:DEBRc0uSZWzPaEJFT Liverpool 1 - 1 EvertonJStadium AstroJ17J2017-12-10T20:16:43.000ZJ693554J2579J170
:DEBstaOjxKf-iIJ&Folge 2827: Der Test | Sturm der LiebeJSturm der Liebe OfficialJ24J2017-12-11T14:10:02.000ZJ46880J710J31
Œ:DEBqp0iWYzJ-ZgJ8Pascal ist sauer auf Kim Berlin Tag Und Nacht Folge#1583JBerlin Tag & NachtJ22J2017-12-11T18:23:51.000ZJ30616J294J3
…:DEB9R1MVPIAevMJ.KÃ¶ln 50667 - Felix will Ben zur Rede stellen!JGoldRain Clips & SeriesJ24J2017-12-11T18:44:11.000ZJ4577J15J4
Ÿ:DEBoCyvdxfn7VcJNRauchmelder: Der Spion in Deinem Schlafzimmer - Gerhard Wisnewski im InterviewJOliver JanichJ25J2017-12-10T15:15:47.000ZJ37672J1298J73
]:DEBgBNCZVRpTTYJKohle - 99/17JWitz vom OlliJ24J2017-12-10T07:22:26.000ZJ36873J429J80
[:DEBV0l1NkhEZb4JWitze-Mix 38JNizarComedyJ24J2017-12-10T17:00:02.000ZJ57762J2824J98
z:DEB8QapM_ySXNQJ-Helene Fischer Show 17 mit Florian ein RitualJbonita heleneJ22J2017-12-11T16:27:58.000ZJ4279J63J2
ª:DEBtKgzndt-GOkJSHayatta Her Åey Var 11 AralÄ±k 2017 - Nuray SayarÄ±'dan haftalÄ±k burÃ§ yorumlarÄ±JHayatta Her Åey VarJ22J2017-12-11T12:04:49.000ZJ53447J995J92
y:DEBCPs6AusJQJwJ/Berlin Tag und Nacht - Vorschau fÃ¼r 12.12.2017JInaa 144J22J2017-12-11T19:04:48.000ZJ28912J155J8
j:DEBMej6I6AWOhkJI fixed YouTube RewindJ
jacksfilmsJ23J2017-12-10T20:32:02.000ZJ1209120J114614J2761
´:DEB731ttBSq75gJ\Die Beleuchtung (deines Wunschpartners, Ex oder Dualseele) - Wochenorakel 11.12 - 18.12.2017JLuna Maries SeelenblickJ22J2017-12-11T13:51:02.000ZJ3138J153J5
„:DEBz4ceL4pnHgYJ1Folge 2562: PlÃ¤ne fÃ¼r die Zukunft? | Rote RosenJRote Rosen OfficialJ24J2017-12-11T13:10:01.000ZJ9074J87J3
j:DEBN5ZGZ7LJo0gJWenn AUSLÃ„NDER SCHNEE sehen ..JRussakJ24J2017-12-10T18:32:03.000ZJ81285J6335J233
u:DEBugslNvd5tnIJ+Outlander S03E13 i like this, it's diffrentJ	Ella bellJ1J2017-12-10T23:25:43.000ZJ36752J159J3
t:DEBW0njCkm8Sk8J(Yemekteyiz 71. BÃ¶lÃ¼m - CanlÄ± YayÄ±nÄ±J
YemekteyizJ24J2017-12-11T14:11:44.000ZJ29808J90J21
y:DEBGS7NUXb_66EJ.The Daily Show with Trevor Noah - Dec 11, 2017JTV ShowsJ22J2017-12-12T04:22:14.000ZJ27604J587J36
’:DEBa7NJ6Gek9v4J<ALL TIME GREATEST AIRPLANE SEAT - Emirates First Class SuiteJCaseyNeistatJ22J2017-12-11T23:45:03.000ZJ2880365J182110J3717
‡:DEB1kjAyIez3pQJ,Folge 2828: Stich ins Herz | Sturm der LiebeJSturm der Liebe OfficialJ24J2017-12-12T14:10:02.000ZJ47660J665J31
o:DEBwc6tgAfMHWwJDolunay 24.BÃ¶lÃ¼m FragmanÄ±JÃ–zge GÃ¼rel FanJ22J2017-12-12T14:29:37.000ZJ68597J532J22
t:DEB_AJ3Hrd7ni8JBackbeest sondereinsatz3JDe Schwatten Ostfrees JungJ22J2017-12-12T13:30:24.000ZJ7214J419J15
‚:DEBynxyvutTNUcJ+KÃ¶ln 50667 - Ben bekommt Ã„rger von Aydin!JGoldRain Clips & SeriesJ24J2017-12-12T18:26:28.000ZJ6204J27J0
:DEBy3smmpE1afwJ9Familie Dr Kleist Folge 87 GroÃŸe Kinder, groÃŸe ProblemeJFamilie Dr KleistJ1J2017-12-12T19:07:58.000ZJ24757J1166J13
¥:DEBVvIRNdpcrhgJAAdÄ±nÄ± Sen Koy 238-239-240.bÃ¶lÃ¼m fragmanÄ±ğŸ˜²ğŸ˜²ğŸ˜²ğŸ˜²ğŸ˜²J ADINI SEN KOY ASK_ZEHOM_AÄ°LESÄ°J22J2017-12-12T16:47:04.000ZJ158606J845J40
H:DEB5rq0vNqyvIgJaJnftJ22J2017-12-11T02:45:52.000ZJ45375J117J648
:DEBbzCg8LWL6D0J+Folge 2563: Der Weg ins GlÃ¼ck | Rote RosenJRote Rosen OfficialJ24J2017-12-12T13:10:02.000ZJ8332J102J3
u:DEBss8DXhA1mbgJ(Yemekteyiz 72. BÃ¶lÃ¼m - CanlÄ± YayÄ±nÄ±J
YemekteyizJ24J2017-12-12T14:15:32.000ZJ34843J115J35
w:DEB8oKl_qDJHt4J'How to Hijack Amazon Prime Now for GoodJ	Rob BlissJ24J2017-12-12T11:35:43.000ZJ466511J25226J942
k:DEBIpx8Kq-etcUJ!Mainz 0:2 Dortmund Tor von KagawaJ
Dark TigerJ22J2017-12-12T21:29:25.000ZJ2635J16J2
¬:DEBShVltoTQybYJVWWE Monday Night RAW 12/11/2017 Highlights HD - WWE RAW 11 December 2017 Highlights HDJClassy WrestlingJ17J2017-12-12T14:58:51.000ZJ599332J5610J445
o:DEB8UO4l-64LSkJ#Abonniert Gronkh, deabonniert Bibi!JiKuchenJ23J2017-12-10T17:00:01.000ZJ40081J2716J181
’:DEBa7NJ6Gek9v4J<ALL TIME GREATEST AIRPLANE SEAT - Emirates First Class SuiteJCaseyNeistatJ22J2017-12-11T23:45:03.000ZJ3495663J198519J4655
s:DEB5ioOX-37JkoJ 100000% U WILL LAFF + RIP SlippyJ	PewDiePieJ23J2017-12-13T22:27:07.000ZJ1582168J152498J2014
l:DEBktWKTdAzQtwJGrundeinkommen-VerlosungJMein GrundeinkommenJ25J2017-12-13T16:29:55.000ZJ8737J108J5
:DEBDD_qvPv7Jw4JCKÃ¶ln 50667 - Jule hilft Ihrem Chef bei der Suche nach Seinem Ring!JGoldRain Clips & SeriesJ24J2017-12-12T19:05:20.000ZJ71715J390J77
{:DEBJOZzku2SrzQJ'I will legally change my name to LitFamJ
jacksfilmsJ23J2017-12-13T19:12:14.000ZJ1041510J131128J1173
|:DEB_U8E9M29f7oJ'DiriliÅŸ ErtuÄŸrul 99.BÃ¶lÃ¼m FragmanÄ±JDiriliÅŸ TelevizyonJ1J2017-12-13T17:33:04.000ZJ61978J465J17
y:DEBA8vnvuX14i0J%Folge 2564: Kinderwunsch | Rote RosenJRote Rosen OfficialJ24J2017-12-13T13:10:02.000ZJ8481J101J7
k:DEBIpx8Kq-etcUJ!Mainz 0:2 Dortmund Tor von KagawaJ
Dark TigerJ22J2017-12-12T21:29:25.000ZJ9183J29J6
‚:DEB6ZuVo4xc3jUJ4Engel Orakel der Liebe vom 13. bis 20. Dezember 2017JDasEngelOrakelJ1J2017-12-13T08:08:01.000ZJ7095J212J5
©:DEB2ZkY2WM9EUYJLSoy Luna 2 - Clip: Sharon erinnert sich an Lunas leibliche Mutter (Folge 77)JVidNer123/Soy Luna 2 - ClipsJ24J2017-12-13T15:40:38.000ZJ4620J167J4
k:DEBdTpXpgAR8r8J398 - shafie ayar Bad e HeratJshafie ayarJ22J2017-12-13T14:40:32.000ZJ21026J600J49
„:DEBSfj5i6S4DnwJ9Jan bricht Zusammen !!! | Felix ist TOT !!! | KÃ¶ln 50667JYou can seeJ22J2017-12-13T19:53:42.000ZJ7624J59J4
:DEBKbmNie5mZD8J3Folge 2829: Bezaubernde Begegnung | Sturm der LiebeJSturm der Liebe OfficialJ24J2017-12-13T14:10:02.000ZJ43827J668J34
²:DEB6YcbsekphGcJfThomas MÃ¼ller hat mÃ¤chtig SpaÃŸ im Interview mit der Moderatorin nach Heimsieg I Bayern VS KÃ¶ln 1-0JTIME 4 SPORTJ22J2017-12-13T21:56:09.000ZJ2997J36J4
¬:DEBM9Bt2CZmQ7EJbSoy Luna 2 - Eine Nachricht an JazmÃ­n und ihre Antwort dazu/ Amanda warnt die Valentes (Folge 77)J	PlaybrushJ1J2017-12-13T17:57:05.000ZJ15880J310J3
:DEBy3smmpE1afwJ9Familie Dr Kleist Folge 87 GroÃŸe Kinder, groÃŸe ProblemeJFamilie Dr KleistJ1J2017-12-12T19:07:58.000ZJ53492J1781J19
v:DEB0DmmMopSKAQJ#FT Manchester Utd 1 - 0 BournemouthJStadium AstroJ17J2017-12-13T22:18:18.000ZJ517315J1883J120
¥:DEB05aC8WERkdoJ?Jingle Bells - Eine Familie zum Fest | Trailer Dezember | Sat 1J'TrailerClips Deutschland [ Since 2017 ]J22J2017-12-11T11:57:06.000ZJ3106J2J2
†:DEB-T9fvQLDeeYJ=Soy Luna 2 - Simon und Luna haben SpaÃŸ in CancÃºn (Folge 78)J
Soy LunitaJ1J2017-12-13T19:12:02.000ZJ1983J57J0
y:DEB8oKl_qDJHt4J'How to Hijack Amazon Prime Now for GoodJ	Rob BlissJ24J2017-12-12T11:35:43.000ZJ1104195J52956J2211
“:DEBtR3xMnEptBsJEJames Franco Answers The Disaster Artist Phone Number  - CONAN on TBSJ	Team CocoJ23J2017-12-13T03:18:19.000ZJ190959J4203J37
:DEBqK1gzjFdIcsJ2Stirile ProTV de Astazi - 13 DECEMBRIE ora 17 - HDJStirile ProTVJ25J2017-12-13T15:40:40.000ZJ9605J34J2
°:DEBwsKNtZxApJ4J^Dwayne Johnson & Kevin Hart's FULL INTERVIEW On The Ellen DeGeneres Show | December 12th, 2017JBreaking NewsJ23J2017-12-13T09:44:04.000ZJ172845J1895J43
:DEBU0jojdmDmK4J?Piet haut Basti wieder in die Pfanne  |Berlin Tag & Nacht #1585JB&K HighlightJ24J2017-12-13T10:01:53.000ZJ11257J84J6
¤:DEBEmWrmhRKPBwJXØªØ¹Ù„Ù… Ø§Ù„Ù„ØºØ© Ø§Ù„Ø£Ù„Ù…Ø§Ù†ÙŠØ© Ù…Ø¹ Ø¯Ø¬Ù„Ø© 71.. Ù‚Ø§Ø¹Ø¯Ø© Ø§Ø³ØªØ®Ø¯Ø§Ù… dassJDijle BedroJ27J2017-12-13T12:18:47.000ZJ3805J409J2
i:DEB6USCI3px46wJ Broilers - Die Tour geht weiter.JBroilersJ10J2017-12-13T15:26:49.000ZJ4289J164J1
‰:DEBOaKKQpfLGKQJ=Lea hat Felix ermordet !? | Alex Rastet aus !!! | KÃ¶ln 50667JYou can seeJ22J2017-12-14T17:47:15.000ZJ8614J29J14
p:DEBCc_bAWf4Gg4J&KÃ¶ln 50667 - Vorschau fÃ¼r 15.12.2017JInaa 144J22J2017-12-14T18:04:51.000ZJ23012J111J8
¿:DEBDjLpLaGPANMJjAhmed Mekky - Wa'fet Nasyt Zaman (Exclusive Music Video) |  Ø£Ø­Ù…Ø¯ Ù…ÙƒÙ‰ - ÙˆÙ‚ÙØ© Ù†Ø§ØµÙŠØ© Ø²Ù…Ø§Ù†JMekky MusicJ10J2017-12-14T11:18:33.000ZJ1414810J102464J1014
:DEB2GkpZv0hUnMJ2Folge 2830: Der neue Mitbewohner | Sturm der LiebeJSturm der Liebe OfficialJ24J2017-12-14T14:10:02.000ZJ41529J585J26
ˆ:DEBeautYJZeEX8J1KÃ¶ln 50667 - Marc versucht Felix zu reanimieren!JGoldRain Clips & SeriesJ24J2017-12-14T17:41:50.000ZJ4672J42J4
Œ:DEBxj_SdxoXk3AJ,Berlin Tag & Nacht - Vorschau vom 14.12.2017J Berlin Tag & Nacht - KÃ¶ln 50667J22J2017-12-14T19:22:12.000ZJ4317J25J1
Œ:DEBK1eRe7uLmnsJ>Frauke Petry:  GroÃŸartige erste Rede im Bundestag! 12.12.2017J
Info KanalJ22J2017-12-13T11:29:33.000ZJ39429J158J110
’:DEBa7NJ6Gek9v4J<ALL TIME GREATEST AIRPLANE SEAT - Emirates First Class SuiteJCaseyNeistatJ22J2017-12-11T23:45:03.000ZJ3967721J211190J5109
¨:DEBAAYH0hTw34kJUBayern Munich vs FC Cologne 1-0 - All Goals & Highlights - Bundesliga - 13/12/2017 HDJFOOTBALL SINTESEJ22J2017-12-13T22:27:09.000ZJ53494J243J16
{:DEBJOZzku2SrzQJ'I will legally change my name to LitFamJ
jacksfilmsJ23J2017-12-13T19:12:14.000ZJ1558963J157163J1728
z:DEBYRYjFXIGFGwJ*Family Stories - Ich hasse meine Eltern(7)JDeluxe VideosJ22J2017-12-14T15:15:29.000ZJ30985J548J16
t:DEBZmJspBgSMlwJ!Folge 2565: WÃ¼tend! | Rote RosenJRote Rosen OfficialJ24J2017-12-14T13:10:02.000ZJ8909J95J4
•:DEBCiKclsiqXMwJHFlula Borg: Christmas Is A Fear-Based Holiday In Germany  - CONAN on TBSJ	Team CocoJ23J2017-12-14T18:06:31.000ZJ74458J2728J41
¤:DEBqmmdG-c2y8wJNErdoÄŸan Ä°slam Ãœlkelerini TopladÄ±, Resti Ã‡ekti. Tarihi KudÃ¼s KonuÅŸmasÄ±.JEVLAD-I FATÄ°HANJ25J2017-12-13T12:28:10.000ZJ393957J9006J490
:DEB4W_YgNW7gs0J/Sharp Edges (One More Light Live) - Linkin ParkJLinkin ParkJ10J2017-12-14T17:59:06.000ZJ237955J38613J129
ˆ:DEB99Sae4jwA68J4Die Drei Fragezeichen - Und das kalte Auge [Special]JDie Drei FragezeichenJ22J2017-12-14T17:00:15.000ZJ8067J0J0
€:DEB8U4SkXFmXz4J7Soy Luna 2 - Jazmins neuer Kanal Ja - Jazmin (Folge 79)J
Soy LunitaJ1J2017-12-14T19:08:28.000ZJ2264J66J0
³:DEBnTcpqGt-AhsJcPeter StÃ¶ger glÃ¼cklich im Interview nach Sieg im 1. Spiel als BVB Trainer I Mainz VS Dortmund 0-2JTIME 4 SPORTJ22J2017-12-12T22:27:00.000ZJ117608J857J53
–:DEBNsUQU3r2nsMJCAyrton Little Was ACCEPTED INTO HARVARD UNIVERSITY AT 16 YEARS OLD!JChangeofplanZJ24J2017-12-13T18:33:55.000ZJ346166J2935J334
:DEBXH0nKX5T2YkJ-2018 YÄ±lÄ±nda Neler Olacak ? HAZIR MISINIZ ?JHerÅŸey DahilJ24J2017-12-14T17:30:00.000ZJ97575J3150J185
b:DEBOPHbqY9LHCsJCRS-13 Hosted WebcastJSpaceXJ28J2017-12-15T16:35:18.000ZJ472573J13690J406
:DEBZlgokLGYtwQJ,Berlin Tag & Nacht - Vorschau vom 15.12.2017J Berlin Tag & Nacht - KÃ¶ln 50667J22J2017-12-15T19:40:16.000ZJ79024J634J44
|:DEBZFT1lrVJ748J3Sophia kann sich an NICHTS erinnernğŸ˜¯ KÃ¶ln 50667J	SerienBoyJ1J2017-12-15T17:49:29.000ZJ11170J55J2
¿:DEBDjLpLaGPANMJjAhmed Mekky - Wa'fet Nasyt Zaman (Exclusive Music Video) |  Ø£Ø­Ù…Ø¯ Ù…ÙƒÙ‰ - ÙˆÙ‚ÙØ© Ù†Ø§ØµÙŠØ© Ø²Ù…Ø§Ù†JMekky MusicJ10J2017-12-14T11:18:33.000ZJ2967625J182453J2482
º:DEB3H_wgGO3pS0JdJacksepticeyeâ€™s Holiday Special | Jacksepticeye, KickthePJ, Crankgameplays, Emma Blackery, PixlpitJjacksepticeyeJ20J2017-12-15T17:10:49.000ZJ1659961J74745J2670
z:DEBzoWVUE5clwMJ#KÃ¶ln 50667 - Sophia wird verhÃ¶rt!JGoldRain Clips & SeriesJ24J2017-12-15T20:03:25.000ZJ5835J57J2
q:DEBCc_bAWf4Gg4J&KÃ¶ln 50667 - Vorschau fÃ¼r 15.12.2017JInaa 144J22J2017-12-14T18:04:51.000ZJ30251J133J27
:DEB4W_YgNW7gs0J/Sharp Edges (One More Light Live) - Linkin ParkJLinkin ParkJ10J2017-12-14T17:59:06.000ZJ413010J48334J189
:DEBG7TK3vqvBuYJ8Arka Sokaklar 462. BÃ¶lÃ¼m FragmanÄ± (Tekin Ã–lecek mi?)JSÃ–Z Vatan SaÄŸolsunJ22J2017-12-15T20:51:03.000ZJ156674J625J69
s:DEBkwlEvJgAteoJ)AdÄ±nÄ± sen koy 241-242.bÃ¶lÃ¼m fragmanÄ±Jdizi hdJ1J2017-12-15T16:27:46.000ZJ117867J715J28
y:DEB3LoQg-f_2loJ.Soy Luna 2 - Sharon verlÃ¤sst Ambar (Folge 80)J
Soy LunitaJ1J2017-12-15T18:55:04.000ZJ14741J531J5
‘:DEBeHgCXc-h5aIJCSchlachtfeld 2017 :) Battlefield 2017 :)  BÃ¼rgerkrieg HO-WELT 2017JAlbaner ElyosJ20J2017-12-16T05:41:38.000ZJ3239J33J87
’:DEBlRmK7-rLR3MJEDon't listen to me i don't know what i am saying-Young Sheldon S01E08JSheikh MusaJ22J2017-12-15T15:54:53.000ZJ55843J232J4
Š:DEBOaKKQpfLGKQJ=Lea hat Felix ermordet !? | Alex Rastet aus !!! | KÃ¶ln 50667JYou can seeJ22J2017-12-14T17:47:15.000ZJ14438J37J65
¥:DEBJhuaL9nJcekJMDer tiefe Liebesblick- Liebesorakel fÃ¼r Dualseelen/Wunschparter/(Ex)-PartnerJLuna Maries SeelenblickJ22J2017-12-15T15:18:45.000ZJ3482J122J6
l:DEBzmrsc8TtgsUJSia - Underneath The MistletoeJSiaVEVOJ10J2017-12-15T02:00:04.000ZJ399172J33697J380
l:DEBbTVo8JGhsy4JDISSTRACK gegen CHAOSFLO44J
LarsOderSoJ20J2017-12-16T14:01:24.000ZJ218165J25995J4984
q:DEBcPAtIGlgFQ0JWÃ¼rdest du lieber â‰ï¸JConCrafter | LUCAJ24J2017-12-16T15:16:03.000ZJ311947J31997J843
i:DEBW7swz028gwQJhydra.clothing ğŸ²ğŸ²ğŸ²ğŸ’JTaddlJ25J2017-12-16T14:34:29.000ZJ98230J9562J777
:DEBYPfln78hf0kJDNew Eritrean film Dama ( á‹³áˆ› ) part 18 Shalom Entertainment  2017JShalom EntertainmentJ22J2017-12-16T15:19:20.000ZJ176157J4392J224
€:DEBmTvwqepJVjgJ'KÃ¶ln 50667 - Highlights vom 15.12.2017JGoldRain Clips & SeriesJ24J2017-12-16T10:18:36.000ZJ13016J119J3
¸:DEBasXYvYRFqj8JiĞ§ĞµÑ€ĞµĞ· Ğ±ĞµĞ´Ñ‹ Ğ¸ Ğ¿ĞµÑ‡Ğ°Ğ»Ğ¸  Ğ’ÑĞµ ÑĞµÑ€Ğ¸Ğ¸ (2017)  ĞœĞµĞ»Ğ¾Ğ´Ñ€Ğ°Ğ¼Ğ° Ñ„Ğ¸Ğ»ÑŒĞ¼ ÑĞµÑ€Ğ¸Ğ°Ğ»J
Dixi MediaJ22J2017-12-16T07:45:29.000ZJ176634J351J146
u:DEBapM21kayWW8J)FULL VIDEO-Final Rites For Presenter KABAJ	GhanaTubeJ25J2017-12-16T13:10:05.000ZJ39874J128J34
˜:DEBLXbFpuopTcAJJBeatrix von Storch  AfD:  Erste GroÃŸartige Rede im Bundestag!! 13.12.2017J
Info KanalJ22J2017-12-15T08:53:00.000ZJ43383J688J185
b:DEBOPHbqY9LHCsJCRS-13 Hosted WebcastJSpaceXJ28J2017-12-15T16:35:18.000ZJ813017J18394J768
›:DEBFtHRM620ecEJRğŸ„Adventskalender 16 .Dezemberâ›„Liebe GrÃ¼ÃŸe von mir ğŸ’•und frohe WeihnachtenJ
Nate ZoobeJ1J2017-12-16T07:02:55.000ZJ14807J0J0
¬:DEBecFA8o175_8JZGraham Norton Show S22E11:  Mark Hamill, Daisy Ridley, John Boyega, Mark Hamill, Sam SmithJLaura awkwardJ10J2017-12-16T01:49:09.000ZJ140232J1834J65
’:DEBovpd6vHlLmEJHFamilie Michael Schumacher: Bitterer Abschied! zieht radikale KonsequenzJTop NewsJ25J2017-12-16T15:19:54.000ZJ16870J35J21
|:DEBZFT1lrVJ748J3Sophia kann sich an NICHTS erinnernğŸ˜¯ KÃ¶ln 50667J	SerienBoyJ1J2017-12-15T17:49:29.000ZJ22439J73J3
Ö:DEBHGLw1ipJoN4J|Ø¬Ù†ÙˆÙ† Ø§Ù„Ø­ÙƒØ§Ù… Ø¯Ø§ ÙÙˆÙŠØ³ ÙƒÙŠØ¯Ø² Ø§Ø­Ù„Ù‰ ØµÙˆØª ÙŠÙ…Ø§Ù† Ù‚ØµØ§Ø± - Ø¬Ø§Ø¡Øª Ù…Ø¹Ø°Ø¨ØªÙ‰ - The Voice Kids 2018JArabs The Voice KidsJ10J2017-12-16T19:58:07.000ZJ365960J7806J197
:DEB1IHHb87vesQJPLOST PLACE - ÃœBERALL KLEIDUNG! WAS IST HIER PASSIERT? | Der traurige REITERHOF!JPJ AdventureJ24J2017-12-16T08:00:02.000ZJ6137J457J11
‹:DEBjeS2GqmWJo8J;Biathlon IBU WC - Annecy/Le Grand Bornand - Ladies' PursuitJHisSable MajestyJ20J2017-12-16T11:56:36.000ZJ6258J48J2
’:DEBZlgokLGYtwQJ,Berlin Tag & Nacht - Vorschau vom 15.12.2017J Berlin Tag & Nacht - KÃ¶ln 50667J22J2017-12-15T19:40:16.000ZJ232587J1293J102
s:DEBkwlEvJgAteoJ)AdÄ±nÄ± sen koy 241-242.bÃ¶lÃ¼m fragmanÄ±Jdizi hdJ1J2017-12-15T16:27:46.000ZJ182191J914J41
±:DEBaUxTFaHzsQoJeNaldo glÃ¼cklich im Interview nach seinem irren Ausgleichstor in 95. Minute I Frankfurt x Schalke 2-2JTIME 4 SPORTJ22J2017-12-16T17:13:55.000ZJ3845J75J4
l:DEBbTVo8JGhsy4JDISSTRACK gegen CHAOSFLO44J
LarsOderSoJ20J2017-12-16T14:01:24.000ZJ417906J34558J8844
r:DEBcPAtIGlgFQ0JWÃ¼rdest du lieber â‰ï¸JConCrafter | LUCAJ24J2017-12-16T15:16:03.000ZJ452381J40498J1529
¯:DEB59da0Zg3aFYJRØ²ÙŠÙ† Ø¹Ù…Ø§Ø± Ù…Ù† Ø³ÙˆØ±ÙŠØ© - Ø§Ù†Ø§ Ù„Ø­Ø¨ÙŠØ¨ÙŠ Ù…Ø±Ø­Ù„Ø© Ø§Ù„ØµÙˆØª ÙˆØ¨Ø³JØ§Ø¬Ù…Ù„ Ø§Ù„Ø§ØºØ§Ù†ÙŠJ10J2017-12-16T21:14:02.000ZJ167758J1490J211
ˆ:DEBNi9yip7Ev_wJ5100000% U WILL LAFF (FAMILY FRIENDLY v7) + RIP SlippyJ	PewDiePieJ23J2017-12-17T20:27:34.000ZJ1405827J103776J2899
l:DEBW7swz028gwQJhydra.clothing ğŸ²ğŸ²ğŸ²ğŸ’JTaddlJ25J2017-12-16T14:34:29.000ZJ134470J11346J1106
Ë:DEB5YiDdjgvTmEJdØµØ¨Ø§Ø­ Ø§Ù„Ø¹Ø±Ø¨ÙŠØ©: Ø£Ø·ÙØ§Ù„ Ø°Ø§ ÙÙˆÙŠØ³ ÙƒÙŠØ¯Ø² ÙŠØºÙ†ÙˆÙ† Ù…Ø­Ù…Ø¯ Ø¹Ø¨Ø¯Ù‡ ÙˆÙÙŠØ±ÙˆØ²J!AlArabiya Ù‚Ù†Ø§Ø© Ø§Ù„Ø¹Ø±Ø¨ÙŠØ©J22J2017-12-17T08:41:16.000ZJ364179J1920J337
‚:DEBAc7vRbEh8HkJ3Adventskalender 17.Dezember.  Liebe GrÃ¼ÃŸe von mirJAdolina LinaJ24J2017-12-16T23:12:39.000ZJ44287J195J36
¥:DEBImmrmVtI2IoJW17.12. 2017 / Stiftung / Bruce / RÃ¼ckblick / ...ob die Rose blÃ¼ht..? / WahrhaftigkeitJAntje SophiaJ22J2017-12-17T18:12:18.000ZJ9471J344J32
¬:DEBAECg42TARVwJ\GroÃŸartige erste Rede von JÃ¼rgen Pohl AFD: Lachen Sie, Ihre WÃ¤hler schauen zu! 13.12.2017J
Info KanalJ22J2017-12-16T10:15:23.000ZJ166213J2564J629
Ç:DEBhc75cKd0E8IJuÙ…Ø§Ø±ÙŠØ§ Ù‚Ø­Ø·Ø§Ù† ØªØ¨Ù‡Ø± Ù†Ø§Ù†Ø³ÙŠ ÙˆØªØ§Ù…Ø± ÙÙŠ Ø§ØºÙ†ÙŠØ© Ø§Ø¨Ø¹Ø§Ø¯ ÙƒÙ†ØªÙ… ÙƒØ§Ù…Ù„ 2017 the voice kidsJHussain AlhasanJ24J2017-12-16T19:28:39.000ZJ95230J995J50
:DEBYPfln78hf0kJDNew Eritrean film Dama ( á‹³áˆ› ) part 18 Shalom Entertainment  2017JShalom EntertainmentJ22J2017-12-16T15:19:20.000ZJ240500J5161J287
‚:DEBxjE6zD_4l7oJ4Engel Orakel der Woche vom 18. bis 24. Dezember 2017JDasEngelOrakelJ1J2017-12-17T10:10:22.000ZJ5067J160J8
:DEBvWxjt-aiDYsJ@AslÄ± Ã‡obanoÄŸlu - Ä°syan Ä°le Geceyi SalladÄ± | O Ses TÃ¼rkiyeJHa BoyleJ22J2017-12-16T21:19:18.000ZJ204468J1062J177
}:DEBCN5OWi6c0SwJ)MC LIFI - Nausja e Lifit (Official Video)JXhevdet JashariJ10J2017-12-17T19:00:00.000ZJ83054J4411J120
Á:DEBAbjMJnoLl08J`Sind das wirklich 4 Euro Freispiele?//Adventskalender TÃ¼rchen #16// 20000 Mittelfinger Spezial!JMittelfinger zum Automat!/MzAJ24J2017-12-16T17:32:44.000ZJ27342J190J103
Ü:DEB8MWMflgalgUJ€ØºØ²Ù„ ÙˆØ¹ÙÙˆÙŠØ© Ø§Ù„Ù‚ÙŠØµØ± ÙƒØ§Ø¸Ù… Ø§Ù„Ø³Ø§Ù‡Ø± Ù…Ø¹ Ø§Ù„Ø¬Ù…ÙŠÙ„Ø© Ù†Ø§Ù†Ø³ÙŠ Ø¹Ø¬Ø±Ù… ÙˆØ±Ø¯Ø© ÙØ¹Ù„ Ø§Ù„ÙÙ†Ø§Ù† ØªØ§JØ¢Ù‡Ø§Øª Ø§Ù„Ù‚ÙŠØµØ±J22J2017-12-17T07:05:17.000ZJ556986J4927J299
‘:DEB6X6M6_3Sbr0J=Die Drei Fragezeichen - Das Grab der Inka-Mumie [Sonderfolge]JDie Drei FragezeichenJ22J2017-12-17T15:41:22.000ZJ6745J0J0
h:DEBIEqFytF3qA4JMein Pinsel juckt (EXTREM)JMii MiiJ22J2017-12-18T14:04:36.000ZJ246453J27991J446
„:DEB4uX8BRsCRE0J5#FLACHWITZCHALLENGE KÃ¶ln 50667 Kevin vs Flo ğŸ”¥ğŸ˜JDidi's KanalJ22J2017-12-18T16:34:38.000ZJ11067J116J23
ˆ:DEB1Vy2K7VNyhYJ>KÃ¶ln 50667 - Schrotti & Elli holen sich BenÂ´s Geld von AydinJGoldRainJ24J2017-12-18T18:15:49.000ZJ43949J328J9
r:DEBcPAtIGlgFQ0JWÃ¼rdest du lieber â‰ï¸JConCrafter | LUCAJ24J2017-12-16T15:16:03.000ZJ479852J42157J1673
Ñ:DEBGrDKt7NwfPsJsã€Šåæ§½å¤§ä¼šã€‹ç¬¬äºŒå­£å®Œæ•´ç‰ˆï¼š[ç¬¬2æœŸ]papié…±åæ§½å¶ç’‡â€œåˆ†è£‚â€ï¼Œåå°‘æŠ¢å¼ ç»åˆšä¸»æŒä¹‹ä½ï¼ŸJTencentVideo è…¾è®¯è§†é¢‘J24J2017-12-18T03:54:05.000ZJ185930J1105J73
:DEBrC5EiQdlYnYJ5Folge 2832: Die Nerven liegen blank | Sturm der LiebeJSturm der Liebe OfficialJ24J2017-12-18T14:10:02.000ZJ35357J622J18
ˆ:DEBNi9yip7Ev_wJ5100000% U WILL LAFF (FAMILY FRIENDLY v7) + RIP SlippyJ	PewDiePieJ23J2017-12-17T20:27:34.000ZJ2133002J136424J3614
¯:DEB59da0Zg3aFYJRØ²ÙŠÙ† Ø¹Ù…Ø§Ø± Ù…Ù† Ø³ÙˆØ±ÙŠØ© - Ø§Ù†Ø§ Ù„Ø­Ø¨ÙŠØ¨ÙŠ Ù…Ø±Ø­Ù„Ø© Ø§Ù„ØµÙˆØª ÙˆØ¨Ø³JØ§Ø¬Ù…Ù„ Ø§Ù„Ø§ØºØ§Ù†ÙŠJ10J2017-12-16T21:14:02.000ZJ179287J1559J327
…:DEB9HHVM3Zg9J8J%KÃ¶ln 50667 - Vorschau vom 18.12.2017J Berlin Tag & Nacht - KÃ¶ln 50667J22J2017-12-18T19:21:02.000ZJ3874J26J0
u:DEBZ6yCh2bEXdIJ(Yemekteyiz 76. BÃ¶lÃ¼m - CanlÄ± YayÄ±nÄ±J
YemekteyizJ24J2017-12-18T14:05:32.000ZJ42140J119J28
p:DEB2Fqj9MYnoQMJMeine Tischdeko zu WeihnachtenJImke RiedebuschJ26J2017-12-17T23:28:16.000ZJ15730J436J38
:DEBm3fX8F0nqrYJ7Oh,Oh..Paula wird Ã¼berraschtğŸ˜‰ |Berlin Tag und NachtJKÃ¶ln 50667 BTN Exklusiv!J22J2017-12-18T18:31:59.000ZJ6273J54J1
:DEB1mG4Dia8oOEJ>Eva Herman: Glyphosat und die Menschheit, ein ungleicher KampfJWissensmanufakturJ25J2017-12-18T12:06:08.000ZJ8003J715J9
x:DEBMHvbQABOYgMJ$Folge 2567: Geschlagen? | Rote RosenJRote Rosen OfficialJ24J2017-12-18T13:10:02.000ZJ8666J100J5
:DEBzBoNq4UixAwJ6Siyah Beyaz AÅŸk 10. BÃ¶lÃ¼m - Asli Bakma Bana Ferhat!JSÃ–Z Vatan SaÄŸolsunJ22J2017-12-18T20:20:44.000ZJ177290J1143J31
¤:DEBXsNhRnW5onIJXUNVERSCHÃ„MDHEIT!   Zur AFD habe ich alles gesagt, ich nehme  keine Fragen von denen an!J
Info KanalJ22J2017-12-18T14:45:49.000ZJ5766J18J101
h:DEBIEqFytF3qA4JMein Pinsel juckt (EXTREM)JMii MiiJ22J2017-12-18T14:04:36.000ZJ361844J34717J834
 :DEBjixcuQJJ_IQJXğŸ„20 .Dezemberâ›„Adventskalenderâ„ Liebe GrÃ¼ÃŸe von mirğŸ’•Frohe WeihnachtenğŸ…ğŸ»J
Nate ZoobeJ1J2017-12-20T01:21:52.000ZJ8575J0J0
}:DEB7ZH_ln3H814J2KÃ¶ln 50667 - Holly beendet die AffÃ¤re mit Chico!JGoldRainJ24J2017-12-19T19:08:17.000ZJ40489J243J21
˜:DEB2JNM-BYVNHcJ=Folge 2833: Ein Ã¼berraschendes GestÃ¤ndnis | Sturm der LiebeJSturm der Liebe OfficialJ24J2017-12-19T14:10:02.000ZJ43239J610J26
€:DEBfXJyC8_GrgMJ0Sturm der Liebe Vorschau fÃ¼r Folge 2834 -  2838Jsturmderliebe99J24J2017-12-19T14:14:49.000ZJ10643J55J5
€:DEBr1z-XOkJL2QJ.ANIMUS - INTRO (OFFICIAL VIDEO) PROD. BY GOREXJAzadoffiziellJ10J2017-12-19T17:00:03.000ZJ25708J2580J113
m:DEBZfriMKEp2FsJ+Lewis v MÃ¼nch (R1) 2018 World ChampionshipJGCJ17J2017-12-19T23:24:51.000ZJ4667J62J4
„:DEB4uX8BRsCRE0J5#FLACHWITZCHALLENGE KÃ¶ln 50667 Kevin vs Flo ğŸ”¥ğŸ˜JDidi's KanalJ22J2017-12-18T16:34:38.000ZJ29275J305J85
¦:DEBGlMwHKpoZ6EJAAdÄ±nÄ± Sen Koy 243-244-245.bÃ¶lÃ¼m fragmanÄ±ğŸ˜²ğŸ˜²ğŸ˜²ğŸ˜²ğŸ˜²J ADINI SEN KOY ASK_ZEHOM_AÄ°LESÄ°J22J2017-12-19T16:36:54.000ZJ152385J1032J36
Ò:DEBGrDKt7NwfPsJsã€Šåæ§½å¤§ä¼šã€‹ç¬¬äºŒå­£å®Œæ•´ç‰ˆï¼š[ç¬¬2æœŸ]papié…±åæ§½å¶ç’‡â€œåˆ†è£‚â€ï¼Œåå°‘æŠ¢å¼ ç»åˆšä¸»æŒä¹‹ä½ï¼ŸJTencentVideo è…¾è®¯è§†é¢‘J24J2017-12-18T03:54:05.000ZJ327576J1788J141
‰:DEBtpbn6IPn8S4J#Gold fÃ¼r Marie und Civa - Vlog 131J&Daily Vlogs - Harriet Charlotte JensenJ15J2017-12-19T06:00:05.000ZJ10990J0J0
w:DEBTBvvqmZ4XHsJ)TOP 10 ğŸ”¥ Drohnen Tipps fÃ¼r EinsteigerJArthur KonzeJ28J2017-12-19T16:52:43.000ZJ4343J328J16
x:DEBz_vrT1droXEJ%Folge 2568: Hintergangen | Rote RosenJRote Rosen OfficialJ24J2017-12-19T13:10:02.000ZJ8150J81J8
†:DEB456xFw2kAyYJ-OMG...Lea macht eine Ansage!ğŸ˜  |KÃ¶ln 50667JKÃ¶ln 50667 BTN Exklusiv!J22J2017-12-19T18:08:45.000ZJ3974J31J2
:DEBbbT-40KYqV4J,Familie Dr Kleist Folge 88 Wie Hund und KatzJFamilie Dr KleistJ1J2017-12-19T19:11:15.000ZJ21213J1132J7
°:DEBhdtphfRL06sJdChristina Baum AfD:  Der BevÃ¶lkerungsaustausch hat lÃ¤ngst stattgefunden, hÃ¶rt euch die Zahlen an!J
Info KanalJ22J2017-12-19T10:25:07.000ZJ5080J186J15
‹:DEB4-TvPbhubhQJ5Andreas Popp: Was steckt hinter der Bitcoin-Hysterie?JWissensmanufakturJ25J2017-12-19T19:03:54.000ZJ56558J1510J301
f:DEBCNCNPx0xfxgJÙ¾ÙˆØ²Ø®Ù†Ø¯Ø¨Ø§Ø¬Ù‡â€ŒÙ‡Ø§Jherai tvJ24J2017-12-20T13:46:12.000ZJ47597J913J41
:DEB9LtCAl5ukXcJ9Google Home Mini | Googles sprachgesteuerter LautsprecherJGoogle DeutschlandJ28J2017-12-20T14:00:39.000ZJ18394J247J52
h:DEBIEqFytF3qA4JMein Pinsel juckt (EXTREM)JMii MiiJ22J2017-12-18T14:04:36.000ZJ389325J36034J899
}:DEBb-7ETcmrRnIJ.DISSTRACK gegen CHAOSFLO44 â® RÃ¼ckwÃ¤rts â®J
LarsOderSoJ20J2017-12-20T17:00:07.000ZJ48925J4728J180
}:DEB7ZH_ln3H814J2KÃ¶ln 50667 - Holly beendet die AffÃ¤re mit Chico!JGoldRainJ24J2017-12-19T19:08:17.000ZJ75759J439J50
j:DEBghdvtOmaihsJ Wenn AUSLÃ„NDER TANZEN lernen ..JRussakJ24J2017-12-20T18:33:02.000ZJ39534J3732J53
u:DEBIJFLt9g3-XsJ(Yemekteyiz 78. BÃ¶lÃ¼m - CanlÄ± YayÄ±nÄ±J
YemekteyizJ24J2017-12-20T14:07:25.000ZJ36071J118J44
m:DEBiZ1Jf0PJErgJ401-shafie ayar Removing NoorJshafie ayarJ22J2017-12-20T07:36:04.000ZJ34260J1046J105
ˆ:DEBqTK0gBsdhkMJ5Dualseelen/Seelenpartner Orakel vom 20.12.-27.12.2017JAnnas Home of LoveJ22J2017-12-20T16:01:26.000ZJ4352J171J1
:DEBmq-Zd5-K1hMJ$OMG...Mel reicht esğŸ˜² |KÃ¶ln 50667JKÃ¶ln 50667 BTN Exklusiv!J22J2017-12-20T17:13:35.000ZJ12387J109J3
:DEBy6GjnQcvmuAJ2Folge 2834: Die fehlende Aussage | Sturm der LiebeJSturm der Liebe OfficialJ24J2017-12-20T14:10:02.000ZJ39754J616J22
Í:DEBtTpNeEowYd8JÙ…ÙˆØ§ÙÙ‚Øª Ø¯Ø§Ú©ØªØ± Ø¹Ø¨Ø¯Ø§Ù„Ù„Ù‡ Ø¨Ø§ ØªØµÙ…ÛŒÙ… Ø­Ú©ÙˆÙ…Øª Ø¯Ø±Ù…ÙˆØ±Ø¯ Ù¾Ø²ÛŒØ±Ø´ Ø§Ø³ØªØ¹ÙØ§ÛŒ Ø¹Ø·Ø§ Ù…Ø­Ù…Ø¯ Ù†ÙˆØ±JOnly AfghanJ22J2017-12-20T15:53:14.000ZJ13924J123J18
€:DEBr1z-XOkJL2QJ.ANIMUS - INTRO (OFFICIAL VIDEO) PROD. BY GOREXJAzadoffiziellJ10J2017-12-19T17:00:03.000ZJ45521J3247J161
ˆ:DEByas09xCafnYJ4Premijera - 20.12.2017. - Ceca proslavila Sv.Nikolu!JEmisija PremijeraJ24J2017-12-20T09:45:48.000ZJ48776J165J43
:DEBbQ_-psxaYMcJ,Folge 2569: Fiese Verleumdungen | Rote RosenJRote Rosen OfficialJ24J2017-12-20T13:10:02.000ZJ8143J91J9
